"I seldom write reviews unless I’m extremely free, it’s 7am and I have been tossing around in bed.   Now, it’s staycation season in Singapore and many locals are looking for a getaway. Full of rave reviews here about great service and how kids are so happy here. I wish to cover something more basic or what a traveler is looking for.  The bed is firm and it’s totally reminds me of hotel beds in China hotels. The interior is old whole grandeur / resort which also is a very popular interior choice of Chinese hotels in China. Maybe because I usually book newly build hotels that are modern, edgy and hip so that I can observe new interior trends, materials and new design. This totally feels like the type of hotel my China suppliers will book for us. Feels very on the road for me."
"The staffs were extremely friendly and helpful. They gave a nice surprise decoration for my husband's bday celebration. My kids enjoyed their stay there. We brought my kids to Buds and they had a great time.  I appreciate their staff Mika, who pleasantly checked on us. As for dining, we were approached by Nicholas who was kind enough to let my son take his cereal with him, as he was busy running around. Overall, i love the services, the clean and safe environment. I Would recommend a stay at shangri-la."
"Had an enjoyable staycation at Valley Wing, Shangri-La Singapore.  The room is gorgeous but somehow relaxing and very comfortable.  Also the lobby lounge is luxurious and the service was stunning. They offer wide selection of drink menu, including champagne, cocktails and non-alcoholic beverages.  We really enjoyed our stay there.  Though the hotel is in the city, inside of the property is a totally different feel. Lots of green and pool is huge...just like an oasis in the city.  Thanks for all the staff who is very attentive and friendly, especially Aishah, front office team member at Valley Wing, who shared interesting story about the hotel and area.   Will look forward to go back there soon!"
"Our 1st staycation since the C-virus reached the shores of S'pore, in 23 Jan. 2020.  Now I understand why this hotel is a hot favorite with locals and tourists.  The exceptional level of customer service was experienced when I stepped into the lobby.  Mr Ono noticed me standing in queue and offered his assistance. He explained why it seemed crowded, how long the wait might be and suggested we wait in the nearby lounge.  I was grateful that although all the parking lots beside the building were occupied, he moved aside a signboard and guided me as I reversed my car into the space he created.  Ms Noara put a smile on my kids' faces when she offered 2 squirrels (soft toys). Realizing that I would like a new view from the room-window, she reserved a room on a high floor, with a"
"We stayed at the Valley Wing at Shangri-La over New Years and it was an amazing experience! The stay was very luxurious - the staff take note of your smallest preferences and ensure you have a pleasant stay. The room itself was huge and very comfortable. They included Mustela kids amenities for my son and even gave him a stuffed toy (squirrel) upon arrival - he loved the treatment!  The splash zone is particularly fun for all - we went there every day during our stay. Our son also loves buds and we were pleased they had a drop-off option for 4 and above - it gave us some downtime as well :)  And yes, we need to book time-slots for the splash zone and buds (the link is provided on arrival), but this was really easy and we always got the timings we wanted.  I also loved the"
"Was looking to this stay as we are celebrating a special occasion with a stay at the Valley Wing.   There were so many things to look forward to but to our disappointment.   1. Attention to Guest at the Champagne/Lobby Lounge  There aren’t many guests around but it is so difficult to get the attention of the wait staff on several occasions.   2. Attention to Guest at the Patio  We were relaxing at the Cabana located just at the Patio section and ordered drinks with the wait staff. After waiting for an hour, seeing them serving the Cabana beside us and not us, we were baffled and re-ordered. However, the drinks still did not reach us and we just left.   3. Food Delivery to the Room  We ordered some takeout and the hotel reception called us to come to collect the food instead of"
We had a pure indulgence and pampered stayed at the Valley Wing for my 30th Wedding Anniversary.  Served and assisted by very helpful staff which made our stay very memorable.   Looking forward to our next stay
"Front office that checked us in: IFFAH Very proper with check in procedure. Check in fast and smooth. Yana offered to take pic and frame it for us as a momento  Amenities provided. Parents celebrating 34th anniversary.. Roses and towel swan ! very detailed and professional/skilled. Thank u housekeeping team! (Only mum ask why no bidet in the toilet.) My cousins celebrating advance birthday.  Balloons cake n cards provided. Very detailed.  Personalised card and cake by Yana and guest relation team. My parents n my cousins very impressed.  Breakfast team at the main restaurant, the line, all very prompt. Even offered my nephew milk, without asking.  Buds team called us to reconfirm on our booking to the Splash Zone.  We were extended late check out, so went to front office to"
"Just recently completed my 4th Stay at Valley Wing since CB started , A short 2day 1 night stay just before Christmas through their Valley Wing Indulgence Package.  Having stay at most of the five star hotel during CB, I must said that Shangri La Valley Wing Indulgence represent best Package of them all. It entitled me to have whole day Champagne ,afternoon tea,evening canapés, 90 min spa per couple at Chi , Summit Room Breakfast and lastly 8pm late check out.  We have make use of this package of our past stays and always enjoy with the company of their amazing Staff, during pre Christmas period the hotel is full house and Staff were working very hard to serve everyone.  Every Staff is great but I will like to give compliment to some of the staff we met for the past few visit"
Rooms were assigned promptly. Went to the pool even tho weather was not in favour but my kids loved it. Loved the indoor playground Buds. Kids were free to roam around the playground and play with various things. Would love to be there again soon!
"The hotel is located in a quiet serene part of downtown Orchard. It offers a huge array of dining options including a famous buffet restaurant (The Line). The rooms are huge and well designed. Staffs are professional. Overall, a hotel that is easy to recommend."
"Currently checked into the hotel this weekend, all excited for our staycation for a belated bday celebration for our baby who turned one. Came with high expectations after reading the reviews online, hence requested for early checkin at 2pm if possible for baby’s feed time.   Checkin process was no issue but the person attending to us left a very sour taste in my entire experience as the first person to attend to us. JOVINN wasnt warm in her welcome, DID NOT explain about my booking and rooms to me, DID NOT explain about how i can book for Buds and Splash Zone. She did not explain about things i usually would experience. I had 2 bookings for my parents in law as well and i requested for same floor or connecting rooms if possible and i understand if we cant get it since we are"
"From the moment I dropped off from my vehicle, I could feel the warm welcome and great hospitality from every service staffs I met along the way! Service was prompt, great high tea! My stay at the Garden Wing certainly feels like a holiday! Would love to return again soon! Keep on the good work!"
"As a jade member i have stayed many  shangri la hotels internationally. This is by far the worst stay mainly Because Of the poor hospitality by the frontline check in staff, ZILA. As the first person we met and who attended to our stay,  she was hostile, unfriendly and unreasonable. It is the first time I’ve encountered such frontline staff, from shangri la nonetheless. Could the management seriously look into Zilas conduct as she totally ruined my staycation and this has never happened before for shangri la. Intend to also report her conduct to management too. This is a pity because all the other shangri la staff service was top notch and it’s A Great pity that Zila was the first person we met and unfortunately due to her, totally ruined the staycation experience."
"Myself, wife and 3 kids (11, 6, 18m) just finished what was a wonderful 3 nights in a the Valley Wing of this fabulous hotel.  I don’t normally write reviews but this place warrants sharing. The staff and level of service they offer are unmatched in Singapore - just amazing (a great team all round, so attentive and big shout out to Nora and Raja for making our experience perfect). Valley wing luxury and services are just wonderful.  Room, facilities, F&B, Spa are all excellent. If you are looking for a family friendly staycation in Singapore, look no further (lifeguards, buds play area, splash zone make this a favourite of all ages). We have done many and nothing comes close for a family.  Already booked the return on checkout and can’t wait."
"Check in was extremely fast and seamless. And the room is spacious, comfortable and nice.   We proceeded straight to splash zone after changing and it was very fun except that there were many leaves in the water. One thing to mention is that the lady at the Splash zone (sorry didn’t get her name) is very helpful and friendly. When I went back to the locker to get my phone, she approached me and let me know how I could use back the existing locker without moving my things to another locker. I find it a very nice gesture with initiative. :)  The hotel is also surrounded by nice greenery and beautiful koi fishes and waterfall which is soothing and relaxing. Overall we love the environment very much!   We also had ice cream at the waterfall kiosk beside the pool and then had our"
"In my last review I shared about the lesser-than-stellar service experience that we had during our stay at Valley Wing about 5  months ago. In response to my review, the General Manager hoped to welcome us back for a renewed experience again at the hotel. Well, we were back again, to spend our New Year at Valley Wing.  The very moment I stepped out of the car at Valley Wing entrance, I could sense the difference. I was readily greeted by friendly and helpful doorman Ryan who immediately came forward to help me with my bag and opened the entrance door for me. He also offered to keep our bags to be sent up to our room later (yes, our bags were already in our room when we went up an hour later). As both front desk counters were occupied, a staff by the name of Noel immediately"
"I have had 4 staycations at different five-star hotels recently and this was the most disappointing out of the lot.    Stayed for a night on a Sunday. We only managed to check in past 4pm as our room wasn't ready - we were given two coupons for complimentary welcome drinks while waiting, and the reception was extremely polite, so that was fine. We were initially allocated a room on the 4th floor with a pool view (which I would recommend that you avoid; the lobby is on the 3rd floor), but to our horror, there was a trail of ants on the table after we came back from dinner (I have photos and a video) - we didn't eat in the room and had only made coffee. We called them immediately and they suggested getting housekeeping to do some cleaning - I insisted on a change of room as having"
"Been a fan of Shangri-la for many years and i have recommended this hotel to many friends and colleagues to stay in. Loved their kids’ club - Buds as well. Breakfast laksa is great, but the letdown was the cleaning cloth left in the room - apparently housekeeping was in a bit of hurry! Big no no especially for a world-class hospitality brand, and haste in cleaning a room is the last thing you want especially in covid times. Otherwise it would have been a pretty good experience."
"Had a 3D2N staycation to usher in 2021 from our room at the fabulous Valley Wing.  We were impressed with the vast improvement as compared to our experience of last staycation in July 2020.  We were happy that the hotel has beefed up their staffing to ensure prompt and attentive service at all times.  Despite it was a super peak period during the year end, we did not feel that the service was compromised in any way.  The other major improvement was the variety and quality of the food offered during afternoon tea and the happy hours.  Guests now are able to enjoy them inside Summit Room with the team of friendly staff from Valley Wing helping to deliver the food items selected by the guests.  The only disappointment was that our favourite Japanese set was removed from the Summit"
"Shangri-La hotels are best known for luxury and their well appointed amenities. I stayed at the one located at Orchard for a good period of 10 days. It is as beautiful from inside as it is from outside. The balconies adorned with flowers all over, looked straight out of a movie. Indeed a picturesque property it is.  I had booked a 1 BHK apartment there. It was a spacious one BHK ever. A large dining space, an enclosed kitchenette with all necessary vessels in place, a large bedroom with a king size bed and a bathroom. Although we didn’t get the balcony, but the space was large enough for a family to survive. The housekeeping service is superb, they try to serve you at the earliest. There was only one thing that bothered me and that was the washer/dryer which was common for the"
"Despite a bit of hiccup during check in, the service and hospitality of the Shang is truly impeccable. Staff know what to say, what to do, slip ups are rectified immediately; so much staff empowerment, a joy to see. Polite, service outlook is across the board- front desk, poolside, housekeeping - I am truly impressed. Facilities like splash park and buds are a haven for my toddler. And price wise, most reasonable for this many facilities, good restaurants and comfort. Certainly will be back and highly recommend!"
"We had a fabulous time with excellent service felt throughout the Shangri la team spearheaded by Nora, the Valley Wing manager. Having our whole family dressed up for Christmas was definitely welcomed by all. We will be back."
"We had our breakfast at The Line restaurant and due to Covid 19, breakfast can only be ordered with pre-set menu. The restaurant waitress, New, was attentive to my kids’ needs and went the extra miles to give them plain croissants instead of the normal mix basked of breads amongst other requests. Great client focused mentality and willing to go the extra miles!"
"It is a good and fantastic Place to visit, good hospitality service, staffs are all well trained. Felt happy when we are here, good recommendation from friends, hope to come back again, thank you for everything."
"My wife and I booked the couples retreat staycation package for stay during the Christmas weekend. While the hardware was good, we were disappointed and felt that the package was not fulfilled. Under the package, we were entitled to 50% off for couples massage. However, the spa was fully booked during our stay. We were given $50 dining credit, and additional 20% discount off food. However, the Waterfall Italian restaurant was fully booked during our stay. In the end, we redeemed a bottle of wine instead. In the Expedia booking, one of the features stated was early in at 10am and late check out at 2pm, subject to availability. Needless to say, the hotel was fully booked and no early check in nor late check out was allowed. During the stay, we requested daily newspapers but were"
"Enjoyed 3 staycations to celebrate our 30th Anniversary.  Our staycation at Shangri-la was our third and final one.  However, though nice, we did not get the wow feeling that we got from our staycations at Fullerton and Andaz, both of which were equally great and wonderful!  We stayed for 1 night in the Garden Wing.  Room was spacious, very well maintained, but dated.  And there was not much of a garden view from our room.  Thanks for the nice cake for our anniversary delivered to our room!  Hotel has a nice grand lobby.  Breakfast at The Line was sumptuous.  Staff there were attentive and service was prompt. Gym and pool were great.  We had lunch at the Waterfall Restaurant which turned out to be disappointing.  The hotel also messed up the bill, and added the dining credit to"
"We (2a2c - 1 10yo & 1 7yo) had a superb 3d2n stay and for someone who doesn’t believe in staycations, I’m a convert now! We really felt like we were holidaying in a resort outside of Singapore! Great service throughout starting from check-in, lifeguards at the pool, staff at the poolside bar, splash zone, buds and the restaurants! Kids didn’t want to leave and want to stay at the premises forever to quote them - adults too actually 😬! We thoroughly enjoyed ourselves and can’t wait to come back soon! Thanks very much to the whole team for the great hospitality!"
"Excellent experience from the arrival till the end.  My family and I always felt at home, especially thanks to an amazing and attentive staff (merci Dominique!).  The stay in the Valley Wing is an experience I’ll recommend to everyone. Hopefully, to be repeated soon."
"The wonderful and impeccable service of Shangri la!  I called for 2 care baskets at a time when they are full on orders, and when delivery was full and wasn’t possible anymore (and I also asked for a minimal customisation). They did it anyway with a lot of smiles and patience so that the festive cheers could be brought to 2 on quarantine at different locations.  I also changed the pick up timings 3 times.. And when I was worried that they wouldn’t be ready.. they told me that they were all long prepared and ready so that I’d be sure to get the baskets even if I move the pick up date forward!   I know there has been a short of hands and staffs at services industry and therefore I am grateful for the great service experience I received from Jonathan, Crystal and Ellen!! Service at"
"I booked a 3D2N family playcation package at the hotel and stayed at the garden wing. Check in was a pleasant experience- despite there being a crowd, a staff attended to me and ushered me to the next available receptionist. Grace, the receptionist recognized that we were celebrating my wife's birthday during the stay and wished her promptly. There was a birthday amenity placed in the room along with a personalized birthday card which made for a great start to the staycation.  Everything great about this hotel(amenities, friendly staff, great dining options) has been mentioned so i won't elaborate on that here. What I wish to highlight is the level of hospitality that the shangri la strives to achieve. From addressing me by name with each phone call, to their attentiveness to"
"This is my third staycation in singapore in the last 6 months and was definitely the best by a long shot.  I stayed 2 nights /  3 days at the Shangri la - Orchard , with my wife and 8 year old daughter.  I initially booked the garden wing suite but was upgraded to the valley wing suite , which was much better.  The valley wing rooms are more modern and equipped that the garden wing rooms.  The valley wing suite was very spacious, luxurious and comfortable.   We also really enjoyed the valley wing lounge access which had free flowing drinks including champagne all day and canapes in the afternoon and evening.    The Shangri la is amazing for families with young kids.  My daughter enjoyed the splash zone , ginger bread decorating class, buds, the pool etc.  One recommendation is"
"With the COVID situation, we could not travel overseas so we decided to try out Shangri-La Singapore Orchard after I saw the Splashzone & activities @ Buds that the kids could indulge in. Seriously, I thought 2 nights were long but I kinda regret now - should've booked more nights!!! The staff were warm, friendly - made me felt really like I was on a vacation and with the poolside drinks & food, time really flew past while we were all relaxing around and in pool. Activities scheduled by Buds team were also fun - my kids are tweens so they didn't like the kiddish stuff but Buds had activities like Tie-Dye shirt & baking to keep them entertained for a while. :) We'll be back in Mar next year - I will definitely book more nights then! Kuddos to the Shang team for making our Dec"
"It was a fantastic birthday staycation for me. Thank you Iffah from front office for being very professional and delivering excellent standards of service. I would also like to express my gratitude & appreciation to the guest relations, housekeeping for being very prompt. This is the best staycation I have ever experienced in Singapore. They even go beyond service for my little one and I am very grateful for that. The hotel has exceeded my expectations, in service, hospitality and professionalism."
"On 20th Dec, we were at the Line for breakfast. As we came very late due to caring for my baby, the breakfast had closed. The were not serving anymore breakfast although it is still before 11am. Manoj took the initiative and offered us some food and fruits that were still at the counter. Although we couldn’t choose what to eat but it was sufficient as we couldn’t ask for me. This is customer service at its best! NB: There were a few staff that simply ignored us. Worst, there was one that pretend that we are invisible despite waving our hand at him. Ask for Mr Manoj! Thanks for going for the extra mile. We really appreciate it!"
"Awesome Staff who are concern about my family's well-being consistently during our stay, Will definitely return for another stay! To all staff, hang in there, we will overcome this pandemic together and soon will return to normalcy!"
"Always feel very relaxed and happy whenever I visit Shangri-la hotel whether it is for a meal or staycation. This year we decided to try out the ala carte buffet at the Line as our boy was a picky eater and was pleasantly surprised about the efficient process despite the restaurant operating full house. Chew, who was taking care of our area makes excellent effort to attend to our needs. Thumbs up and keep up the good work!"
"We went for a 2D1N staycation at Shangri-la (Orange Grove) on 13/12/20 to 14/12/20. We had a wonderful time there and all the staffs who’ve attended to us were very helpful and friendly. They have all made our stay in Shangri-la an enjoyable and pleasant experience!   Kudos to the receptionist whom attended to us when we came earlier for check in and the staff arranged for an upgrade to a bigger room for us (with no extra charge). She made this special arrangement so that we won’t have to wait too long (originally we booked Garden view) for the room to be ready and hence we were able to go into our upgraded room right away. On top of that, the staff also arranged for us to have complimentary drink at The Line. Staff Nicholas from The Line served us with warm welcome and provided"
"Thanks for the birthday cake for birthday celebration. The only disappointment is it was a Xmas log cake instead of a birthday cake. It came without candle and cutting knife.  I appreciates on the early check-in arrangement for us. But there were no welcome fresh fruits for Gold member.   The picnic basket is really special but the food from the picnic set are all cold from the fridge. There are some activities for kids, but most of them are suitable for younger kids (preschooler). Suggest to add more activities for older kids."
"We arrived on 13 Dec morning after a long flight. There were many hotel staff to guide us every step of the way. It was very well organized. Check in was at one of the function rooms and was a breeze for about 14 people who arrived at around the same time. Although we were all on SHN, I don’t feel like we were treated as second class. Staff happily and patiently answered our questions. Our bags made it to our rooms even faster than us. Meals arrived on time as scheduled. They were generally nice, with some tasted better than others. I ordered some food from Grab and another delivery company and they were promptly delivered to the room by the concierge. I want to say a big thanks to all the staff who were on duty on that morning and to the concierge staff who worked tirelessly"
"We just completed a 3 night family staycation at the hotel and all I can say is superb on every level. The standout was the staff. Every single staff member we engaged with was happy, polite, friendly and helpful. They knew their job, they helped solve, they asked if we were okay. It was service at a level that justifies the cost and the experience. We stayed in the valley wing, highly recommended for all the extras. The family play cation package added to the experience for our 7 and 9 year old boys. Pool access was well managed, and despite it being busy and only a 3 minute taxi drive from our house it felt like we had got on a plane and flown off to somewhere exotic, fun and fabulous. This is our second staycation post circuit breaker, and as a family we cannot fault the"
