"It was a lovely experience staycationing in the Shangri-la's Valley Wing. Upon arrival, you feel like you have returned to your luxurious home. The reception by the old Japanese bellman was so professionally done. You may forget that you are in Japan. The check-in by the manager, Nora, was again done so professionally. It was like talking to a friend.   Our luggage was all ready in our room when we entered. There was a quiet element of WOW FACTOR. The view was great and the room was wonderful. Spacious and well planned room with an equally spacious and exceptionally functional bathroom, with all its defined spaces.  Perks of staying at the Valley Wing ... many! An exclusively peaceful and quiet sanctuary !You can choose to sip your champagne or Singapore Sling and more from"
"I appreciate how the Shangri-la team pays attention to details when it comes to service and providing the needs of their guests. I stayed with my two children at Shangri-la f and was delighted with the quality of the amenities. I've had some of my best sleep in this hotel, and my kids also said they enjoyed their stay."
"The initial warmth and speedy service soon faded away as I checked-in to my room with them. The food was grotesque. Would you ever eat quinoa with raisins paired with beansprouts and tofu? I mean the chef seems like a very confused person and shouldn't a trained chef in a supposed 5 star hotel know the difference on how western and asian food hits your taste palette. I'm not suggesting fine dining but if you can't do fusion, stick to the basics, possibly cheaper too. On top of that, I was told that your pastry was made the night before and sent out to the rest of the Shangri-La group hotels and thus the extremely bad pastry. It's soggy and disgusting, being in the F&B business you'd know to eat pastry fresh or even hours of making of making it. Simple guys, think simple."
"While I have been to this hotel for a number of times, this visit was my first staycation here. We were here primarily for the Buds and Splashzone. Else we are more likely found in the main Orchard road hotels for a shopping staycation or Sofitel Sentosa for a relaxing stay.  One day prior to the check-in, I received an online check-in notification through their app and what surprised me was the incidental deposit the hotel has requested. For a 2 nites stay, I was asked to put up a $1.5+k deposit for incidental charges and this amount also included the room rate. Issue here is that I have already fully paid for the room rate a few months back and thus, why are they charging me for the room rate again? Nonetheless, I proceed to make the payment to facilitate the online check-in."
"It’s our first and I must say the best experience ever for the family. There’s so much activities that hotel offers and regretful that we only booked for a night. From our checked in, we were greeted warmly by Ms Calista. She is such a pleasant receptionist, whom makes us feel so comfortable in making queries and she truly anticipated our family needs. She over heard our conversation when we had to make changes on our dinner reservation when slots at Buds for our daughter timing was not available. For that, we are totally impressed and would like to thank her for organising it so well for us. Special thanks to 2 guest relations that noted on my request for arranging cake surprise for both husband and son birthdays! Ofcourse, not forgetting a tall very tall gentleman that handed"
"We had a wonderful staycation at the Shangri-la Orchard. We were glad we chose in the Valley Wing indulgence package as it really made our stay particularly luxurious. We were there for my birthday and the staff kindly arranged a free cake. We took our toddler daughter who enjoyed Buds and Splash Zone (though she was disappointed to find out that most of the water slides were for 4+). We really appreciated the outstanding service and Le Yi who served us in the lounge was particularly friendly. The massages we had with our package massages were very good.  We are vegetarian and although they had options in the lounge, it was a bit limited and they did not create additional dishes to compensate for this (as they did at the Ritz), which would have been appreciated. Nevertheless, we"
"Impeccable service from receptionist and dining staff. Especially thanks for Mdm New from THE LINE, for her attentiveness and excellent service. Her dedication to great customer service makes us felt comfortable and well taken care of. Truly holding up to the great customer service motto of the hotel chain. Thanks for the great experience!"
"similar to hania_sg, I just had a staycation at fullerton the week before. Like at fullerton, staff at shangrila were really nice and pleasant. But at shangri la there are lots of activities for the little ones so would strongly recommend to families with young kids. special thanks to haliz, iflah, hyen yen. there was a filipino male staff at buds who was so nice too but i didnt manage to get his name. he was giving me advice on how to change my splashzone resevation due to the rain. my 6 yr old boy enjoyed his stay there. He got to do gingerbread cookies, play at the buds indoor playgrd and the splashzone. My son had such a great time.  My husband felt the room was too dim. I also felt cleanliness was acceptable but could be improved given the high standards of shangrila."
"We just had a great staycation at Fullerton thus we expected Shangri-La would give the same experience. But oh boy, you guys even set the bar higher in term of service. Every staffs that we had interaction with were all genuine, friendly and enthusiastic. From Ms Callista who handled our check in, Ms Dora Tan the servicing manager who greeted us and came with surprise for the kids, Ms Ling Ling who took good care of us during breakfast at The Line, the crew at splash zone and buds (Rajesh and Lionel),  Nicholas at The Line who took effort to chat with our kids while they were waiting for the ice cream and not forgetting the friendly doorman. Thank you Shangri-La for the wonderful memory. We will be back soon."
"Paul is very attentive, he pays attention to the guest and is aware of your preference plus will give recommendation when he was @ the line for BF today on 2nd of Dec and on 19th of Nov too! Great job to you and your team!"
"Had a wonderful times again at Shangri-La with a fun filled activities for kids - splash zone, koi fish feeding, kid friendly pool, garden picnic and buds by Shangri-La. The team has put up Christmas decorations across the hotel areas and add the festive feeling to the stay. I would like to compliment New from The Line for her service during breakfast. It was school holiday and busy peak hour, however she delivered excellent services to ensure we are served on time. My 18months toddler removed her shoes without our knowings and we left the restaurant after breakfast. New took the shoes and searched for us to return. I really appreciate her great service and feel proud for a local Aunty who had demonstrated high professionalism as a hotel staff. Thank you Shangri-La for a"
"Nice place to be at, and dine in. Came with my family to celebrate my sister’s birthday, and went to the Line Restaurant. The check in was fast and simple, staff were nice, not overly crowded. Well organised hotel, and great decorations."
"We stayed in the ShangriLa Orange Grove road for the weekend in the Valley Wing. Couples retreat option is definitely the best value for great quality including the 90 minutes massage, high tea and canapés. Not to forget the rose bubble bath my friend managed to try was also included in the price. I would highlight the super great waiter who looked after us, Alvin who is the most professional waiter and great host as part of the ShangriLa.  I would highly recommend this option to friends, families and couples. Don’t miss out if you enjoy quality time in a nice atmosphere."
"We wished to compliment the following staff members that delighted us. We checked-in on 18 Nov for a one night stay.   1. Check-in staff Miss  Jovinn for making the additional arrangements on top of what I believed had already been pre-arranged. She is detailed and is knowledgeable to address me queries. Her sweet and warm disposition really made our check-in enjoyable and delightful.   2. Mdm. Jenny, our room attendant. She made a point to pause her work when she saw us leaving our room to greet us and to find out if there is anything she could help while we are away. We are happy with the level of cleanliness in our room.   3. To the staff whom did the shoe-shine for us. Whoever you are, Thank you so much. We can see the effort you put into making our shoes shine.   4. We"
"We had the most wonderful time at Shangri-La celebrating my friend’s birthday.  We decided to upgrade to the Valley Wing Indulgence package a few days before arrival and the reservation team was happy to help with this no problems.   What an indulgence it was - we had access to the lounge with daily afternoon tea and evening canapés along with UNLIMITED Moet champagne and cocktails. In addition it included a 90 minute massage at the Chi Spa. I would say go ahead pay that extra $200 per room just to upgrade, it’s so worth it!   The rooms were spacious and clean. Bathroom was huge and plenty of wardrobe space. They had set up balloons and cake for my friend which was a lovely touch.   The only improvement I would say is that the rooms were a little dated and in need of more"
