"Celebrated my birthday with my SO just yesterday, was surprised at how posh-looking the place was. We were upgraded to a nice corner room which was already a very pleasant surprise and was greeted with a little cake + balloons to celebrate the occasion. The view of the twin towers at the pool deck was amazing, even our hotel room allowed us to soak in the twin towers in all its beauty   We ended our stay with lunch at Yen Cantonese restaurant, and since it was our first time there, we asked one of the staff to recommend some of the delicacies to us. Mr Elvin Wong's recommendations was spot on and a total delight as we absolutely enjoyed the Xiao Long bao and the ""Ha gao"". He even went as far as preparing another small customized birthday cupcake for me upon hearing that we were"
"We stayed on the 6th October and it was fantastic, probably the best Hotel in KL. Excellent service, best location. Very well designed rooms and lots of details in the rooms which are absolutely perfect. Great time at the bar and breakfast at Flock was equally good. Highly recommended to any business or leisure traveller."
"Got pleasantly suprised by the W team when we booked this specatular room for my birthday. They really put a lot of attention to all the details and we were amazed. Splendid room, amazing amenities, service and everything. Had dinner at the Wet Deck and the pizza was exceptional. Breakfast the next day at Flock was also amazing. Will be back surely next time if we want a getaway to KL. Special mention to Benedict (Flock Manager) and Melanie (Flock) together with the Meliha and Ashley who really surprised us with the details in our room.   Thank you again W."
"We stayed here for a weekend staycation and the experience was very good!  We had a great time in afternoon at the pool with marvelous view of the Petronas Towers. Later we visited the spa for a relaxing massage. The room was very nice, modern with view of the towers and very comfortable. Diner was in the Cantonese restaurant Yen, so far the best Cantonese food we have had in our 3 years stay in KL. To end the night we visited the Wetdeck, were it was (socially distanced) crowded, great atmosphere, good music and delicious cocktails. Breakfast at Flock restaurant was super, lot of choices and very high quality. All together the perfect staycation and definitely would recommend!"
"We stayed for 4D 3N..The experience was awesome. My first appreciation is for their service..TOP Class! The staffs at Flock were very humble, helpful and kind..Thanks to Melanie,Azila,Shoburn,Hanis,Nathan,Suria and Eizlan.. Every morning they gave us a great positive vibe. Breakfast was very tasty and wonderful presentation- kudos to the Chef and team. Wet Deck was located at a superb site with great KLCC view. There were 2 young Indian boys as waiter who were very helpful and humble. I am sorry to not remember their name. Our room was the Marvelous Suite which was super big and clean. Housekeeping were very helpful and fast. In room dining was above expectation as well.. We will definitely return to W KL simply because their service!! Pease keep up your good work. Those humble"
"Visited Wet Deck for a friend’s birthday recently. Amazing view, delicious food, and the service was over the top. Price is also affordable. And shoutout to Lun for the most efficient service, super professional and also friendly, making it a comfortable and a smooth birthday dinner for us. Cheers."
"Staying here for 3 day 2 night at Marvelous Suite.  Ohhhhh demmmmmm the Suite is sooooo soooo Marvelous & Yummy😆 big space, big toilet, designnnnnn is really really MARVELOUS😍😍😍 view is facing KLCC (too too too Marvelous😍)  Service is sooo sooo awesome from all department.  W Kuala Lumpur is one of the best hotel in Kuala Lumpur👍 Keep it up💪🏽  Your guys is really really MARVELOUS😘  Cheers, Azrel Ismail"
"We just had a stay over this weekend at W Hotel in the Marvellous room for 2 nights. And it was indeed awesome! Here's what we thought: 1. The hotel is doing an excellent job of meeting all the RMCO guidelines, down from the breakfast table to check in.  2. We had requested an early check in but our room wasn't ready due to a late check-out. So we were parked in another room for few hours & given a late check out. This was much appreciated.  3. The Marvellous room is highly recommended. The interiors are so cleverly done & amenities provided are excellent. This holds true for the entire hotel i think. 4. Breakfast (buffets on Sundays only) are very good & staff attentive.  5. Spa service was excellent & both of us enjoyed it thoroughly.  6. The Suria mall is just 2 mins away &"
"If you looking for typical 5 stars hotel with finest service, W is not for you. W hotel is fun, outgoing and yet caring in enough to make your stay memorable. I would like to say thank you to Christian ( GM), Kristine (Reception) and Melanie (Flock restaurant), for the outstanding service and arrangement, especially Melanie  who treat me like a close friend, with all the small talk and close friends tips for my stay at the the hotel.  The marvelous suite is really wow, wow and wow... pictures says the thousands words.  I  tried the spa also, it is so amazing and wow wow and wow, best massage 💆‍♀️ ever. I will definitely come back and even one of my friend decided to book after my review. Thank you W Hotel. LOVE 💘 you guys."
"Stayed several time in W KL, and this time was to give my kids a delayed Birthday celebration, emailed W insider Meliha about it and Kristine gave us an amazing arrangement, room was upgraded , we got W original Chocolate cake, balloons and also my kids photos were printed. The team really spend their effort to take care our stay.  Flock and Pool side bar Wet are still as good as before, Ben and his teammates are always keen to serve their guests, very happy to see them as COVID have limited my travelling this year. Reception staffs are very friendly and staffs at the gym and pool very attentive as well, W KL pool is just a fantastic place to relax.  Just can’t wait to plan my next stay in W KL again. We enjoyed our short vacation with W KL."
"Our 1 night staycation in Aug 2020 to celebrate our anniversary was nothing short of “Marvelous”!   The service upon arrival at the front counter was good, Meliha greeted us and it was a classy welcome. The complimentary room upgrade was a pleasant surprise and my wife and I thoroughly enjoyed our stay in the Marvelous suite including the Anniversary room set up.   Special mention to ~ Kristine and Meliha (W Insider) who both were nothing short of Fabulous, they planned the surprise for our anniversary and we’re perfect. A momentous occasion which my wife and I will cherish for years to come.  The Wet Deck experience was awesome including the pool boy(s) + Flock for the breakfast. Service was of a high quality, everyone was welcome and smiling, accommodating our requests which"
New and modern hotel. Room was clean and well kept. Able to use mobile phone as room key which is great as you don't have to carry the usual key card. Staff friendly and accommodating. Only feedback would be Flock restaurant's music was too loud during the buffet dinner. Music should be just in the background and not overpower table conversation. Otherwise great hotel.
"We really enjoyed our stay in W KL. This is by far one of the most attentive & chic hotel, even before the actual stay itself. Received WhatsApp (not many will go to that extend, mainly using mail) from W Insider - Kristine. She is so friendly & helpful, top notch service. The moment we stepped into W, it was very welcoming from concierge to front desk team. Well done! They have a very fun & chic interior design and pool. My daughter & I love spending our time there, doing people watching, playing with water & all the fun floaters that were available! 💗 Despite having a bath tub in the room. The W Deck drinks were also very creative & nice. My fave was their Suda-Tuak-Ka. Food at Yen was delicious too, we had the buffet dim sum. Only set back was, the view from our room. Was"
Booked a night stay for my parents and thanks to Meliha for making their stay great! Meliha was very responsive to all my inquiries and helped me to prepare a handwritten message for my parents. The room is spacious with view amazing view of the twin towers. My parents enjoyed their stay very much thanks to Meliha and everyone at the hotel. Definitely will stay again!
"Room was flawless with great view as usual, never a let down. Front office team is superb, courteous and attentive. The main highlight of W KL is Food & Beverage quality, top notch! Definitely not about the quantity but rather quality. The croissants was perfect, flakey and buttery as well as the pain au chocolat, easily the best I’ve tried in KL. Well done to Chef Adam and the team!"
"This was our 3rd stay back here and we loved every minute of it. W Kuala Lumpur has the complete package! Whatever/Whenever is W Hotel’s motto and this property lives up to it. We loved the amazing Marvelous suite, the top-notch and attentive service, and the exquisite food here. They have enough restaurants and bars, superb activities such as spa, gym and swimming pool in the hotel to make us stay in the hotel. I’d recommend trying the AWAY Spa, Chinese food at YEN and the Sunday Retox Brunch. The other highlight of our stay was the pool overlooking the amazing Twin Towers. Definitely one of the best views in town!"
"It's quite rare for a chain hotel to have characteristics and charm of a boutique hotel. But W has proven that it is possible  The room interior is amazing, and the view from the spectacular room is to die foor. Imagine waking up with the petronas twin tower in front of you.   2 queen beds were just perfect for a small family, with aplenty of spaces still available in the room  Amazing service too, considering the hotel industry is struggling, n they probably had to downsize the number of staff. But the quality of the service was unaffected"
Really attractive Hotel. We stayed there for two nights. staff was excellent and helpful. Pool area is the best. we had awesome Dinner there at the restaurant and its memorable. foods are delicious and serving attractively. quite expensive but they got best Collection of International and Asian Cuisines.
"Overpriced and overrated. I guess the price is because of the location. I expected more as review from tripadvisor is very good. Unfortunately, I did not get what I expected. Firstly I message their FB to ask for birthday celebration, they send me an email Add to insider ,  so I email, and no reply until the day I arrive. I had also mention it when I did the booking via Agoda stating that I’m celebrating a birthday. Also, nothing. Check in is smooth,  early check in allowed. Then I call to reception to inform about birthday, and they arrange a cake and balloon. Breakfast is dine in, mentioned 9.30 but by 9.50 only they called to inform that there will be delay. Food presentation is good, but taste is so so only. Bed is comfortable , room view is Kl tower, bathtub is not clean"
"When it comes to a W Hotel, you either will just love it or hate it. There isn't a middle ground. I personally am a fanboy when it comes to the brand. It is loud, fun, with a touch of pampering and glitzy glamour that comes along with it.   WKL  is one of my favorite so far. Amazing people, amazing rooms, amazing view an amazing pool and amazing FOOD, (yes i said Food).   I will sound like a broken record if I talk about how the room is and how the service is over here. When we come back to a hotel repeatedly, it is somewhere we know that has done it right.   Yen and Flock are two amazing F&B outlet. The dimsum is to die for! And Flock has the most amazing breakfast spread. I may rate them the best breakfast in the city? its a very close call but it is on the top of our list."
"I stayed here for a 3D/2N staycation with my boyfriend to celebrate our 1st year together. We chose this hotel cause of its great location in KL City Centre and based on all the great reviews we have read online. We received a pre-arrival email from Kristine (W Insider) and were glad we met her during our check-in. We booked a standard Wonderful Room, but Kristine and Sudhir (Director of Rooms) surprised us with a 5-tier upgrade to their Marvellous Suite... WOW!!! Literally W-O-W!  The W Insider team did a fantastic job at arranging cute and romantic amenities for me and my boyfriend. They even set up a handful of colourful helium balloons to further heighten the 'WOW factor'. I had a hard time eating the amenities because they were simply too pretty!  The suite was very"
"The W Kuala Lumpur is easily one of the best and certainly the greatest value W’s I have had the pleasure of staying with. Of the 50 plus locations in some 25 countries and my wife and I have experienced many past stays at more than 17 W's in some 13 countries throughout Asia, Europe, North, Central and South America as well the Middle East and most frequently at Bali.   Over our three night stay, amongst the many standout features of this relatively new hotel opened in August 2018 included   -the superb and massive marvellous suite which probably has the best double shower ever;  -the excellent and discreet morning and evening housekeeping;  -the generous Titanium Elite recognition which includes a full nightly happy hour at 6.30pm with hot and varied snacks;  -an exceptional"
"Last Sunday 29 Feb, I went to W Hotel had a breakfast with my friends.  I like Flock restaurant design and environment, stylish and modern Their breakfast is buffet style and their also have some their signature breakfast in their menu, I like their food especially smoked salmon egg benny, this is from their menu, i highly recommended.  Their service is bravo, why i said so ? Because when i entered Flock, their staff even is busy to clear table, they still will look at each customers and talk friendly and giving warm services. This is how i feel at their professional services.  A good compliment i would like to give a staff named Hanis, because he is the person who recommend the smoked salmon egg benny, haha, he is a friendly person and he know how to give some suggestions to"
What can i say from the moment we checked in we were welcomed warmly by the staff for our anniversay.There is one person in the hotel that made the whole experience so much better with his warm presence and all over helpfulness and taht person is Sudhir.If you are reading this Mr Metzner you have an individual here who takes your hotel to another level with his persona he is an asset to your hotel and the marriot brand there is not enough words to describe his service and help we recieved from him.Thank you Sudhir you made our stay at the W kuala lumpur one of the best we have had in any city and wont ever forget you.Mr Metzner  look after this gentleman he is what makes your hotel a cut above the rest. P.odedra
"We have the best times of our trip staying in this hotel. The w insider, Meliha arranged nice cakes, printed our photos and set up our room with rose petals for our anniversary.  The room was nice and spacious. Overall it was a comfortable and happy stay for us.  The design of the hotel is great and the staff service is amazing."
A very modern n chic place to stay.... infact we stayed twice in our malaysian trip The decor is really modern nice colors.... the moment you enter the lobby it feels like youve entered a bar... since we are a muslim family i got worried that maybe we have booked a wrong place but everything turned out fine Really good wifi many choices at breakfast perfect view from our suite of the pool and petronas The curtain blinds were really cool 2 things i ddnt enjoy 1: the toilets can not be locked 🥴 2: the cleaners do not do their job properly..... black surfaces had amazing amiunts of dust settled on thm (on both our stays) the stains that i noticed on piwder room shelf were not cleaned throught our stay
"Booked a room for the start of our honeymoon trip right after our wedding and it was fantastic! We were greeted accordingly by all the hosts and had a smooth check-in. We were also given a late check out and to our surprise, we were upgraded to a better room category complete with a cute honeymoon set up! Little that they know that I was a Marriott employee and would care for all the little details of my trip but they still exceeded my expectations - so bravo and big thank you to the W KL team, from the check in to the breakfast staff, bellboys and housekeepers, you have all made our stay wonderful and one of a kind ❤️"
"Well, what can I say. Just great. Brilliant location and view of the Petronas Towers. Rooms are fantastic (#1604). Staff are super friendly and we will definitely be back our next KL visit. Opted not to take breakfast because we were up and out but had a very nice meal in the YEN Cantonese restaurant. Wet Deck is a nice area for a G&T it three in the backdrop of the Towers"
"We booked for 2 nights the marvellous suite and got upgraded to the 130m2 WOW suite, which was truly amazing with the beautiful views and elevated ceilings. Decor was great and room was very clean. Hotel dining had also exceed our expectation, although it was a shame that we didn’t have the chance to try the breakfast.  Another highlight was the Wet-Deck pool bar — superb view of the Petronas towers and overall a nice bar area.  Only negative was the business Center — not that W is a business hotel or anyone really needs one when at W, but I happened to have been doing some urgent work. They had two computers available in the business Center just outside of the conference rooms, but the area was very un-ergonomic, and looked like a front desk. One of the conference-goers"
We are totally impressed with this hotel! The staff welcomed us with their kindness and warmth and made our stay unforgettable! The furnishings are very stylish. The rooftop bar with this unique view is overwhelming! Love it 😍
"We stayed at the W whilst attending a wedding also at the W - on arrival I was really impressed with the hotel, it is something to look at for sure, what a vibe!  The check in experience was very friendly and the staff on the front desk were exceptional.  The food and beverage service through out was good, the breakfast offering was a stand out for sure - the service at the wet bar could be a little more attentive but at least the views are good!  A must mention is that the senior staff of the hotel were always visible and hands on with their teams - this really shows that the hotel has a great culture and it is reflecting brilliantly on the guest experience"
"I last stayed here about a year ago, and it was such a splendid stay, that I gave a 5 star review then. Decided it was due for another visit just to see has the standards been maintained, and I'm delighted to say, it definitely has. Checked into the Marvelous Suite again, so nothing new to experience, except this time was given a room higher up, so the views are better. Everything is as I remembered it be during my first stay, room is awesome, service is awesome, and this time I decided to spent more of my stay here at the Wetdeck. Nothing beats taking a dip in the pool whilst gazing at the magnificent views of the Twin Towers next door. And at night, the Wetdeck is even more awesome! I didn't get to spend any time here at night during my last stay as it was closed due to some"
"The price is definitely worth as friendly staff, good service, clean and modern design in room and hotel. We were staying two days in this hotel, We will come back again! )) The location are great. But I will give breakfast as four stars. But overall everything was great!"
"One of the best hotel that I had stayed so far. Room, staff, service , food, amenities, facilities are excellent. Special thanks to Lambda, Chef Richard, the Malay lady and gentleman that took care of us during breakfast . Thank you for such a wonderful hospitality. Congratulations and well done."
"I have stayed at W Kuala Lumpur a couple of times since the opening in 2018. The hotel still never fails to impress me over the impeccable service, food and the people which the hotel GM Mr Christian has managed very well.  W brand has always been my favourite among the Marriott chain of hotels and this place certainly is one of the best I ever stay and my preferred choice whenever I visit Kuala Lumpur for leisure trip.  It is situated close to the iconic landmark in KL which is the Petronas Tower and the view is amazing from the hotel.   I am in the midst of planning again this February for a celebration with my partner in lieu of Vday over here and I can't wait.   Highly recommended place to stay over in KL and not to be missed! :)"
"We were so excited for the stay since it was quite pricey but we didnt mind due to the location and view. We booked the Spectacular room with twin tower view.  We arrived before 3pm hoping we can check in early, however we were informed the room wasn't ready and we needed to wait for an hour to an hour and half. We were shocked but the reception was very apologitic, and to compensate us for the inconvenience they gave us voucher for free drinks at the woobar while waiting...after an hour, still our room wasnt ready and i think their manager stepped in and told us they will give us temporary room and we agree. The check in process was a bit slow compared to other Marriott hotels. Anyway, the temp room given was corner room and sooo pretty... we started using the amenities and"
"Perfectly situated in the center of KL, across the street from the Petronas Towers, another perfect stay at the W. This was our first stay at this particular property. Very stylish with a modern, artsy, and hip design. The hotel is fairly new; about a year and a half since it’s opening. It still smells like a brand new car!  The staff was amazing. High complements go to front desk and restaurant staff. They were so helpful and personable. It made our stay better than I could have imagined. We really had the opportunity to get to know some of the hosts and servers and the service at Flock, which is the main restaurant where breakfast is served. We really enjoyed our conversations with the servers. Even though we didn’t have any personal contact with housekeeping, the service they"
"Amazing views of the Petronas Twin Towers from the rooftop. Great food, lovely staff and room service, excellent bar and pool services. So many great spots in and around the hotel to take pictures. Quality of the room was superb! They helped me reheat a food I had brought in from a restaurant the previous day (at no extra cost!) Overall trip and hotel stay experience was worthwhile (money well spent). Definitely recommend."
Following a disappointing W stay in Singapore this blew us away. Amazing space and breathtaking location. Wet deck was cool to hang out in at night. Staff were super on it and gave great service throughout. We booked a suite which looked out on to the towers. Great recognition as a titanium Marriott member. We will be back soon hopefully.
"This hotel is faultless, its got a really cool vibe which is evident throughout the hotel.  The staff can not do enough for you, nothing is too much trouble.  Need anything just press whatever/whenever on your in room phone.  We ate in Woo Bar- snacks,great quality, quirky cocktails with a menu you can throw a dice on to decide what you want!  Flock- just fabulous!  Wet Deck- we went to a party on the Saturday night, great atmosphere, DJ’s.  Excellent pool service, good choice of food and drink.  The view from the pool is to die for.  Had breakfast in bed, again was amazing.  It is worth every ringgit, do not hesitate to book!"
"I have good impression in last 2 stays at W KL and decided to come back again which is not disappointed.   As Marriott Ambassador Elite, I have been upgraded to Studio suite which is much bigger than Typical studio room type (if I am not wrong, it is appx 92sqm). Property also offer beyond normal Marriott scheme by giving both complimentary breakfast and 1,000 Bonvoy points which is fantastics.   Similar to last time, I enjoyed all session in the property from Front desk, Fantastic Chinese food @ YEN, Woo Bar as well as Breakfast at Flock. Only one comment which I feel very disappointed not only this time but with previous experience as well is at WET deck.   I knew this is kind of cool bar for people to have good drink with nice KLCC view but staff behavior is something"
Great stay from the start to the end! We arrived at the hotel in the morning before check in time and was given early check in with a upgraded room to the Spectacular room. Room was beautiful which faces the twin towers. There's enough amenities(even face wash!) in the room so if you are travelling light you won't need to worry. Hotel is close to most places we wanted to go to but beware of the peak hours. Breakfast was excellent with a variety of choices. Overall all the staff were attentive and friendly.
"I was there last weekend stay for 2 nights, i always said staying at W Hotels was amazing experience from room decor & music and W KL is awesome talent service with smile always make you feel welcome and Wet is fantastic always happening on wknd."
