"On the 14th of Dec, 2019, I had a scary experience while staying at the VE Hotel. At 4 am in the morning I had a terrible shoulder and hand pain. My left hand was almost paralysed. I woke up in sweat. I called the hotel staff in desperation and they sprung into action. 3 people assisted me in a wheelchair, rushed me to the nearest medical centre, made me feel completely taken care of. Waited on me till I got the necessary medication and made sure I was feeling secure. The pain eventually receded because of the medicines and I was able to finish my work and come back to Singapore safely. I want to THANK the staff of VE Hotel for their AMAZING & SELFLESS presence and quick action in making sure I was given the right attention. THANK YOU VERY MUCH."
Highly recommended to all for stay up at VE Hotel. The room accommodation was very good. The room is very comfortable. Good view and the all staffs are so helpful and nicely. Fast response from maintenance once we got any problems at the room.
"The hotel even though is located in commercial district of KL, is more than just a business hotel. The rooms were very comfortable. We stayed 2 nights for a conference. The food was good. However for breakfast the hotel has only 1 live station counter which makes it difficult to get omelette."
My 1st time dinning at VE coffee house.. Super delicious food and very presentations... Very calm and nice environment..But they are not served ice water during my dinner.. So its a bit upset.. But overall is awesome.. Thanks to chef Farhan and team for the good hospitality.. Its very recommendation and I will come again..
"You will get the feeling of their full hospitality when you first enter your room - fruits, food, welcoming card and nice facilities. The lady at the dining hall will greet you with a smile always and you will feel the warmth of family from her."
"very beautiful space, good service, special thanks to Mr Shano the bellman for introducing about special foods in Malaysia, and the buffet restaurant as well,  everything is so comfortable. The way from hotel to the conference is good, and the staff are so kind and friendly, helpful"
"Convenient location for shops and restaurants, including those who need to access to the office buildings.  The hotel room is spacious, clean and friendly staffs.  Accessible to many other locations by Grab."
"Stayed 1 night at this hotel to have a feel of their service.I must say the room is superb,clean,modern and well maintain.The rate was at a steal and the room/hotel is way above than those charged higher.Location wise is ok.some eateries across the street (nexus).A mall is about 10mins walk.they do provide free shuttle (11am and 2pm) to mid valley mega mall.Only thing they need to improve is the lighting at the carpark.i find it is insufficient if u return late at night.a bright carpark is sign of the hotel welcoming u home i believe.Lobby is well decorated and modern.They shared the lift lobby with residence but different lifts.so no worries of overcrowding."
Clean room with great front desk services during check in and check out. I checked in approx 9pm and the service at front desk was fast with my room upgraded. Staff from the security to front desk was great. This is my favourite hotel in the kl city ... room was clean as usual... rooms were well equipped ...
"Between July to November, we have stayed at this hotel about 4 times. The last 2 stays at the hotel was not good.  The location of this hotel is good. Room size is a good size that you don’t feel confined. The layout is a good use of space.  In one of our stay, We had issues such as water ponding in the bathroom that resulted water flowing into other areas of the room- the hotel said that they were unable to change the room. They did send an apology note with apples and cookies. They didn’t solve the problem. That time we stayed there for 3 nights.  At check out there is always a long queue. If you are driving and need to get your ticket endorsed at the time of check in or check out, you might need to wait. As there are only 2/3 staff behind the counter.  Room service - they"
VE hotel is one of the best hotel in Bangsar South. The Breakfast buffet has a huge number of varieties. The overall ambience of the hotel and restaurent is Superb. The swimiing pool is also very good.
"Most, if not all, hotel guests appreciate privacy and security when staying in a hotel. That’s basically why there’s a Do-not-disturb sign outside the room. Hotels’ staff would normally respect the sign, and common courtesy expects the staff to not disturb the guests nor enter the room unless in the case of emergency or other exceptional reasons.   There were 2 incidents over my 2 nights stay in VE Hotel that were completely unacceptable. The first incident happened when I requested for an electrician to come fix my air conditioning. I waited but after 30 mins, I decided to put the do not disturb light on and went for a shower. While I was in the shower, the electrician arrived & he knocked loudly on my door. I rushed out of the shower to the door to tell him to come back later."
"So far I have no complaints staying at VE hotel. Very modern interior design and very comfortable stay. The service staff were friendly and helpful, overall experience at the hotel was excellent. However, the only downside is the food selection for breakfast, could have been better."
"Cleanliness was excellent. Staff was polite and nice. Just that I didn't get the room that I booked and delayed my check-in. However, offered me another room which was satisfying for me. The other thing is got to queue for sometime for check-in and check-out at lobby (there were a lot of guests). Overall is good."
"Yes, the hotel is first class but the price is just right, Apart from that, nice swimming pool, friendly staffs, yummy food, and restaurant is beautiful too, just a right place to stay in Malaysia.   I also liked the location of the hotel as there are several restaurants around it,"
"I stayed in VE hotel Bangsar South KL for 4 nights. I was a solo traveler and was there for a seminar. The hotel location is good and there are quite a few eateries and restaurants.  My hotel room was located on 19 floor with good city views.  The room was clean and cosy.  The bed was comfortable too.  Overall,  I have enjoyed my stay there."
"I stayed for one week, room price and room size was acceptable. - I ordered for high floor and king size room, but they said no more king size room and they gave me a middle floor room. - my room located at 7th floor, very loud noise from the street after 8h30 (cars noise, motorbike noise, construction noise, etc...) - check-in service was slow... not enough staff at the front desk (wait around 30min.) - hotel carpark service was stupid... u must go to the reception to read your carpark ticket, if have 10 people doing the check-in service, you have to follow the line to wait for the front desk staff to help you to read your carpark car. - the best things is the breakfast (toast set with the tarik, only10rm)."
The room was excellent for the rate I paid. I got a discount because of the offer given by Agoda. Otherwise the rate was quite high. The location was good as it was quite far away from the city centre. Anyway the Nexus and The Sphere was close by and linked by a skybridge! Thumbs up! The room I got was ok but the TV was not working. Anyway they rectified the problem as soon as I called. The LRT station was about 1.5km by foot and there were not many tourist spots around. A good place to stay if you want to get away from the usual touristy areas. The safe deposit box in the room was also not working. I expect better maintenance for a hotel with reasonably high room rates in KL.
"My office is next door so location was perfect. If in Bangsar South, this hotel is perfect. This is in a new development area with plenty of good restaurants, bars and cafes. The precinct feels a bit like Singapore with manicured gardens. The rooms are new which makes it comfortable. The gym is quite large with a good variety of equipment. There is a changeroom with shower facilities near the gym. The pool design is clever with being under cover but all open. I've stayed there twice now and would each time i go back to the office in KL. The train station is a 10-15 minte walk which takes you into KLCC KL City Centre (Twin towers). The bathroom has quite a few sliding doors (ie 1 that slies across a cupboard and the toilet, another that covers the wardrobe or closes the bathoom"
"Hotel is new, beautiful and very clean. Excellent location with a link bridge connecting to the opposite Nexus Bangsar South Connexion Convention Centre where we attended a seminar. There are restaurants nearby at the Nexus opposite, and a 7-eleven below the hotel. Short cab/grab away to nearby Mid Valley Megamall for lots of shopping and food choices. Some hotel front desk staff are friendly, customer service level is acceptable, but can be improved for front desk staff. Breakfast spread is quite good. Read a few reviews on hearing announcements from the mosque, but we didnt hear so when we stayed at Level 8."
"Very convenient for me since it is located right across Connexion Convention Center where I recently attended a seminar. There's a walkway connecting to the Convention Center. There are a lot of restaurants around the hotel. Also, it is just about 10 mins away from KL Central. My room on the 19th floor was really nice. I booked through an online app and everything I requested was given; a king size bed with daily breakfast. The staff were friendly.  The concierge even offered to call a taxi for me going to KL Sentral at 6:30AM."
