"We stayed in W for 2 nights. Overall we had enjoyed quite alot during our stay. We stayed in a room with twins tower view and it had been outstanding. Room amenities were complete enough to make one feel comfortable.   Food had also been good quality - breakfast at Flock was splendid in terms of quality and varieties. We also took a package which included set dinner - which had also been enjoyable.  Pool at wet deck offers wonderful views which we had enjoyed alot of our time swimming there.   There were however some minor misses in terms of booking, probably due to large number of guests checking in same time with us. But overall I think hotel management had done its level best and I appreciate all the staff for their excellent services throughout our stay that made it a"
"We spent an awesome weekend at W hotel in Kuala Lumpur, Nice contemporary marvelous suite, delicious food and a great relaxing SPA massage...Excellent service! We will come back soon! Alexander and family"
The beds are comfortable and the rooms are fitted to the highest standard.  The gym has the best equipment ever and the view from the pool is one to die for. They have excellent restaurants within this luxury hotel. The location is the best in this city. Located a short distance away is the K Avenue  LRT Station.
"Great meal in Flock on Retox deal - fabulous choice of lovely dishes and good drinks deal. Followed by best Amaretto Sour ever in the Woo Bar. Maybe not the flashiest cocktail in the book but the bartender knew how to create a classic. Excellent service from all the crew, especially Farhan."
"IT was a great weekend at W HOtel with my girls, nice room with nice ambience. Service was good from Peshwin, Jojo & Meliha. They went the extra mile to make us comfortable & made our stay memorable. Love the room as well!"
"Booked standard room and utilise my platinum suite night certificate for suite upgraded. Given Marvellous suite, one of the most popular suite in Instagram/ FB  KIDS all enjoyed the room amenities such as big bath tub, comfy bed, cushy sofa , etc Overall feeling great. Food delicious. Pool with Klcc view. Fascinating scenery from room  About staff, all good. I dun really interact or asking help as I’m busy with kids .  I’m sure will return to this hotel again in near future."
"Great place for a fun weekend staycation with the family. This hotel is very popular during the weekends.  We had a lovely Marvelous Suite for our birthday. Love the spacious and funky room, and the suite was well equip with a generous range of Bliss amenities. The staffs are W are super attentive everywhere we go (thank you Mr Metzner and your amazing team!) and we received excellent titanium recognition here. 🎉 Breakfast is delicious with plenty of choices. The view of KLCC, if you sit at the outside deck during breakfast , is priceless. The rooftop pool and bar serve  a variety of great food and cocktails too. 😍😍"
"Great hotel& facility Nice food and beverage (especially the cocktail) Excellent Staff Even during MCO period, the food and facility quality remain and all SOP are at place to ensure safety Definitely will come again."
"Everything was great except 1) poorly managed CMCO SOP in swimming pool - we stayed 3 days but only on the 3rd somebody stopped us from getting to the swimming pool as she calculated the limit of pax inside exceeded 15 pax. We asked y only last day somebody checked, she said she was not working for the past 2 days. For the past days, the crowd was confirmed exceed 15 pax. At least 30+ 2) water leak from the top window I guess to the windows on my room, as the window frame is steel, we were wondering what sound was it... Initially we thought the window is going to break, only end out seeing the water leak from the top of the floors (can't see the origin of leak) 3) chocolate stain on spoon from breakfast restaurant - need to clean properly."
"My lunch buffet experiences in W hotel is really awesome. I unable to reserve enough tummy space for all the presented food.   All the hotel staff is like really friendly and helpful. Especially when I am looking around for the waiter, they could notice me within a few second.   I am really satisfied with all their food served especially big scallops, smoked salmon, king crabs, prawns as well as the dessert sections. The chocolate under the desserts section are all made in Malaysia, MALAYSIA BOLEH!  Besides, their chawamushi is the BEST! Is a MUST TRY food in W.  I have it for 3 bowls, and I dont feel enought for the chawamushi!  Overall, W hotel is a wonderful place to visit. I looking forward to the next visit. Thankiewww for all the staff who bringing me a delightful"
"This my 2nd times staying over the hotel, overall nothing much to complete nor bad service about it. The front desk chinese lady trying her best to access me. ( I think she a newbie ) will stay again when I'm around town.  Check in 22/03/2021 room 2003."
Bring a family for dinner once a birthday surprise for my nephew book a table for 15 people feel disappointed when it arrives me and my family wait and stand at the main door entrance until there is an empty table!!! one of the guy (staff) he's introduce his self before he send us (azlan)....continue to take us to the empty table while cleaning right with sincerity and also a good smile always there for service never mised order and whatever we needs Thanks for look after my table until we finish😊 Tq very much azlan for arranging and manage our dinerrr😊
"i used to stay here few time back. and recommend many friends to stay here as their front desk, rooms, facilities are really awesome. but their reservation /phone call customer service are the worst. never pay attention to customer during call, poor english, and rude attitude. they even hang up customers call when they can provide advice. this's not a 5 star hotel customer service level, is worst than 1 star. this bad customer service experience are among the worst i had ever encounter..never will recommend again"
"Stayed on the 6th-7th March weekend in the Studio Suite as part of our belated birthday weekend.  Living La Vida Local package included breakfast + dinner.   (We were coming from a night at the EQ, so a lot of comparison to be made as both hotels are similar in price.)  PRE-ARRIVAL/CHECK-IN   Contacted by Maliha via WhatsApp on the eve of my arrival which was a nice touch. Usually, hotels would reach out via email. Requested for an early check-in but was told that a lot of rooms had back-to-back reservations, but she would inform if our room was ready earlier. However, half hour before check-in time was informed that there was a slight delay in getting our suite ready as they had a late check-out. We were already checking out of EQ at this point and was just hoping that they"
"Been to a Wet Deck few times already and it was awesome all  the time. I love the ambiance and spectacular view. Most of all Wet Deck staff  Azlan very friendly,helpful and give a good service. Whenever im there for leisure with my friends I always feels welcome. Thanks to Mr Valko aswell always assuring customer needs. Keep it up Azlan. Will come and find u again 😘"
"Very good hotel with good staff..I stay on 12-13 march.. from the receptionist to fnb staff very friendly and helpful.. Don't know they name coz I didn't see the name tag😂😂.. booking under Marriot bonvoy I  feel so lucky with the service, price and all what they provided...very recommended 🌟🌟🌟🌟🌟"
"Part of the Marriott group of hotels, the W hotel is city centre located near all shopping, retail and transport. Perfect views of the twin towers from the pool deck and the all day dining restaurant."
We are here in celebration of my Dad's 71st birthday. He is very fond of the Twin Tower. We have stayed at majority of  hotels with Twin Tower views. We were a bit skeptical to choose W because we have small kids and W being recognized as a hype hotel for the young ones might not be suitable for us with kids around.  We were totally wrong!!! It was a hotel with   Wonderful hospitality that made us feel very much Welcome. The kids love it and wanted to be back again.  We took the Living La Vida local package and it was WORTH it!!!  My utmost Thank You to the following people who were out there giving us a Wonderful service and experience.  1. Harvi - who attended to my queries from the start and ensured all my requests were taken care.  2. Ashley - who handled my check in and out
"I went to Wet Deck at W Kuala Lumpur,this guy name Azlan is a bartender there,he is very helpful,fast service,very very friendly and he  is good in what he do.Been there few times with all my friends and family yet still his service always the top Good job Azlan and Wet Deck people 👍👍👍👍 See u soon"
The Hi-Tea that we had was amazing and one of a kind that we have ever had. Dennis was very helpful as he made the service wonderful and he had a great explanation. Thanks so much for making our day !
"Food and ambience was amazing. Never felt such an experience before as it was our first time here. Surely is a place to recommend. The service staff was attentive and funny as well, applause Dennis for the service,  Date of visit: 28 February  Place: WooBar"
"So, this is the 3rd review and saving the best for the last in a series of 3 progressive review covering the W Hotel KL. 3rd review since this is our family's 3rd stay at W hotel. Progressive, since the 1st stay was at the more basic Spectacular room, 2nd stay was at a Marvelous Suite and the 3rd stay, the finale - EXTREME WOW or EWOW suite.  EWOW - this is the pinnacle of W Hotel KL and in W brand, is the priciest, biggest, most elaborate, luxurious, blah, blah..... suite you can get. Not every W branded hotel globally have a EWOW suite, though most will have this.   Although categorized as luxury by Marriott, W hotels doesn't follow the classical luxury as carried by other Marriott brands (RC, St R. JWM & non-Marriott  like 4S, MO, GH etc). And so, like all other rooms in W,"
"A place to relax with friends ..... arrived at the table don’t know what to order 🙄 a staff out of the bar continues to recommend and explain about food at the wet deck ..? After ordering food, he continued for a special cocktail drink KUALA LOCCO and Melonyy which is quite tasty and amazing ... He is very friendly for jokes until he does not stop smiling Tq Cool guy Azlan Bartender☺️  #philippinessmalaysia"
"One of my favorite brands of Marriott...i strongly suggest the Yan Chinese Restaurant, good food and great service by its Manager and her team...Bravo and keep it up! A must visit place for me and family whenever we stay in..."
"I have a great experience stay at W hotel , you will get surprise when roll up the sunblind , KLCC view and KL tower view just awesome ! And I order 24 hours room service was delicious ! I really love it so much !"
"Ok those that might read my once in a while posts will know I like quality !!   I don't mind paying for it.  The bi weekly brunch at the W Hotel (out of MCO) is fabulous !! Good food selection for the cost !!! Book early as it gets full, take the drinks package as you will easily drink what you pay up front. Take friends too, it currently has cool music with a awesome saxophonist playing along with the chill out tracks.  You will love the atmosphere, if you do go say hello to Christian the GM tell him I sent you.  Enjoy !!!"
"We checked in on 24-December for Christmas eve buffet at Flock and one night stay, also went to Wet Deck for tea break and nice klcc view, overall a comfortable stay with great service from the staff.   Thanks for the treats and card from the hotel."
"Would like to give a shout out to Farhan and Ruth from the banquet team who took care of us during the 3-day meeting on 9-11 January 2021. They were attentive and always cheerful taking care of all the fussy participants. No request was too hard. I had mentioned to a fellow participant that I love to eat cili padi with my meals. I was pleasantly surprised that I was given cili padi with my main dish the next day 🥰 Farhan also helped arranged for napkins and  a few lights for my group's presentation. Well done and keep up the good work. 🎉🎉 Whatever, whenever!"
"Outstanding hospitality by W Kuala Lumpur. Special thank you to Ms Ly Ling for a great arrangement for our short vacay (immediate contact me upon booking confirmation and easy to arrange), also million of thanks to Wet Deck team for helping us during birthday dinner, also received birthday cake and gift from the hotel, outstanding KLCC view from Wet Deck, sure to come back!"
"The best memories for 2020! In love every single about this hotel. The design was fantastic! The staff was super friendly! The facilities was awesome! I stay for celebrating my birthday with friends. Everything was perfect and excellent. The view from Wet Deck was spectacular facing the famous tallest twin tower, KLCC. I really enjoy the view at Wet Deck! My room was upgraded facing to KLCC, that make me feel so happy and thankful. All of the staff was very nice! During my checking time, Mr Christian/GM come to greet and meet me. That make me feel special and feel ‘home sweet home’. Special thanks to Lay Ling, the super awesome & friendly Duty Manager. Not forget to Ashley and Meliha, thank you for the warm welcome and special arrangement. Definitely i will repeat my stay at W"
Friendly and very accomodating staffs. Poolside bar with great view of the twin tower. Comfy bed. Good food (breakfast and dinner buffet) at the Flock. Came back feeling refreshed and satisified. Worth another stay.
"Book a night to have pre-birthday celebration here, the service was great, everyone was so friendly especially Sin Ling from front desk.  I complained about the room next door was making noise all night and the duty manager comes out right away to apologise. Other than this I was satisfied with the stay, the bed was so comfortable and toilet are clean, our room facing KLCC which gives a perfect view, will definitely come back for a staycation next time."
"NOTE: Visit the website in my profile for the full review and more photos.  Flawless experience from the beginning to the end. Great breakfast, location and views. Staff were amazing throughout.   Definitely take the opportunity to stay in this right now as rates are much lower than usual.  The Wow Suite was spectacular.  Thank you W Kuala Lumpur!"
"Stay for birthday trip and received lots of warm wishes from staffs. In this pandemic period, they did sterilize every corner and record info of guests.  I did order my in room dining breakfast as the restaurant Flock was close down for upgrades at the moment. Most recommend breakfast is Roti Canai with sambal prawn.  Definitely will going to have another stay in the future.  Just a little comment on sound-proofing as I kept hearing the door opened from other guests but I thought my door open. It might be disturbance for someone sensitive to sound."
"I have stayed for 2 nights as a solo guest in January 2020, therefore, lucky enough to avoid the pandemics. And it was a superb stay for many reasons. The core proposal of the W brand may not be suitable for all types of guests, however, it's definitely the best fit unmissable choice for those young savvy travelers who seek for high standard hospitality in the best locations and impressive ambience. The amazing view of the KLCC is an event apart. Thank you guys!"
"First time to W brand, despite not a fan of colorful ambience however it does show uniqueness.  My loyalty being appreciated. Little issue before check in fortunately solved swiftly by the director of rooms.  As expected since the hotel is too close with twin towers that’s good & bad.  WIP access is impressive at wet deck! Love the margarita & samurai.  There are staffs enlighten my stay, Sin Ling, Ehsan, Nana & Meliha. Some shows inconsistency services, hope you guys treat all customers equally, show judging eyes is not cool."
"I have stayed there twice the last 3 months with my family, and we all love the hotel. There is a great vibe at the hotel and the staff is great. I will recommend to get a hotel with the twin tower view, and the premium for this is minimal.  We have tried their high tea, detox Sunday brunch and food in general, and the food is fantastic and is worth just a stop for a great meal.  The strongest point is however their Wet deck with the amazing view, and the great laidback pool area.  We will definitely return again in 2021 for another staycation or two!"
"Been to Wet Deck on 12/12/2020..having my birthday dinner with friends with the amazing view of klcc.. Nice pizza, pasta and sweet potato fries, we order twice... Been entertain/hosting by Ai from the beginning... Very friendly,make sure that we are ok with the seating.. feel that we have known forever.. Thank you so much Ai and all the team.. Will come back again.. To chill and relax.."
"My friend and I did a staycation sometime in Oct 2020 since we couldnt go outstation.  Basically it’s a must to visit it’s wet deck and have a few beers be it day time or night time. Overall the staff provided superb services as they contacted me prior to check in and attended to each and every request in a very friendly manner. Special mention to Christian Metzner who took time to read my review and responded personally. Oh well, stay stylish and fabulous!"
"I was here for 2 nights to end my Asia trip and boy was it the best way to go out with a bang. This was before COVID hit to I can only speak for an experience when the hotel was in full swing and at capacity.  I booked a standard room, but was kindly upgraded to a suite due to my hotel reward status and boy was that suite incredible! The views are attached of the amazing towers which can be seen in full view from the bedroom! The room is well equipped for everything, even for a working set up as I had to log in quite a bit. The bathroom is so snazzy and always my favourite when staying at the W hotels.  Staff are so friendly, always kind and willing to help.   I cannot speak for the restaurants other than breakfast, as I ate out most of the trip but the breakfast selection was"
"WONDERFUL EWOW SUITE for a birthday treat! We were very happy to find a place to be pampered. From the valet, to the warm reception, everyone was very kind. A special thank you to Harvi and Fieza who made our stay extra special.   The suite was spectacular with our very own private pool. It was truly a real treat to stay here. No request was too great for the team to satisfy. Thank you and we will be back soon!"
"This is a very specific review of a staycation at W Hotel during the M'sian Conditional Movement Control Order (CMCO) period. This review may not be applicable during normal times, as the stay environment may be different. This review is applicable to any residence in M'sia thinking of a staycation at W Hotel during this period. And especially if you are a  Platinum/Titanium/Ambassador Elite Member.  Perhaps during this difficult times for the travel industry, most hotels have come up with some pretty interesting and good staycation packages which caters for locals.   W Hotel had come up with one particular package - AMP UP YOUR STAY. This package includes a 2 nights stay with a RM1000 hotel credit, which is applicable to most of the Hotel restaurants (excluding Willow) and the"
"I usually visit W Kuala Lumpur and I always leave happy, but tonight more than happy! We had the best waiter on our table, Harry! He is so funny, polite and always attentive at what customers want and need! W is very lucky to have him as staff, more waiters like Harry are needed in Malaysia!! Thank you W, Thank you Harry!"
"The room was soo great and comfy  , also my host , shahrul was very helping . The view from my room is soo nice at night and morning . Such a spectacular view .  Will come again of course ! One of the best hotel i ever stay !"
"W Hotel KL is the best hotel in kuala lumpur because of it excellent service from W hotel staffs . Even though currently we are facing pandemic Covid-19 ,hotel staff still keep up high service and follow government SOP. Iam really appreciate excellent service from Mr Harvi, Duty Manager, Ms Ashley & Ms Lin Ling, front desk agent for giving me welcome gift, Mr Ehsan welcome ambassador and Meliha for your lovely welcome note. Iam really appreciate exception service and I really recommending this hotel to frequent traveler, businessman and family. The view from Wet deck at 12th floor was spectacular facing the world famous tallest twin tower ,KLCC. The suite very cosy and nice view especially facing KLCC. Thank you again to Mr Harvi for making our trip memorable and beautiful"
"With COVID 19 forcing me to work from home, I desperately needed to get out of the house a day. I booked a room for one night with the goal of pampering myself with everything W hotels are known for.  I am amazed how, during this pandemic, the manage to keep up the high service standards even more for BonVoy Gold member like me.  The entire staff made us feel like at home with casual friendly talk - be it at bar or the restaurant.  They are swift to accommodate for customers’ need when things suddenly change like torrential rain by the Wet Bar, which had guest seamlessly relocating to the woobar.  The local cocktails are very good and plenty of booze in it.  The smoked ceviche, by the way, is worth ordering twice."
"Excellent stay! We really enjoyed our stay at W. The staff were very approachable & helpful. The suite was very cozy & good with comfortable furnitures. The in-room breakfast also was really good. Not to mention, the Wetdeck at 12th floor. Its Really a good place to chill with a nice view. Overall, It was a wonderful experience at W. Thanks so much. We would definitely stay here again!"
Was amazing service by the bartender😊aslan this my second time come and visit wetdeck i like the sunset and view of course the cocktails with the blue colour he makes for us super taste  Thnks and we will visit again That picture taken from goggle wetdeck website that guy (aslan)
"Great experience though for just 1 night stay for my wife's birthday. Helpful and friendly staff, namely Eric. Sophisticated room design. Too bad swimming pool is closed due to CMCO. Will definitely come back again!"
"I live in Sydney, Australia but had to be back to Malaysia to look after my mom who had stroke. My birthday was on the 30th Oct however my husband and in laws wanted to treat me to get some rest and a nice bath. W has always been my fav and any city that has a W Hotel i would definitelt stay at.   This is the first time im checking in the W in KL and i cant express how hospitalble every single staff has been from the beginning until the end of my stay! I wanted to book a spectacular room but Pavan convinced i would much enjoy the Marvelous Suite but then the Room Director Sudhir decided to surprise me with a better room.   I cant believe they surprised me with a WoW room! I was give n a complimentary drink to wait while they sanitize the room and once it was ready i went up"
It was my first time in Woodbar though it was closed during CMCO I was warmly greeted by Erul the welcome ambassador WKL. It was such a great experience as the ambience was very cosy and relaxing along with Erul keeping me company as I was waiting for my friends. I was also welcomed with a detox shot which was very energising. Thank you Erul for your kind hospitality and sharing your thoughts about the hotel and the services they have. I am pleased to have step foot at level 8 and will definitely come back to dine there. What a pleasant service and hospitality once again it was a lovely evening at W.
"Stylish, sleek and dimly lit, The W in Kuala Lumpur is a luxurious vibrant hotel with clever, funny touches in their design and an energy of possibility.   Was it the right place for two married normals to celebrate 20 years together? Absolutely, why not? We enjoyed cocktails and a hookah amidst the beautiful young rich kids in designer clothes and bottle services and just took in the stunning view of the twin towers. No one minded mom and dad giggling like teenagers again at a private table, making jokes about movies they’ve probably never even heard of.   Lots of pretty saucy touches to the hotel room, mirrors above the bed, intimacy kits, chocolate body paint. If you’re a beautiful rich horny person, this place is for you! Or hey, if you’re a couple of married norms looking"
"W team are doing great in sanitising & maintaining hygiene for common area & room. Thanks for the effort on providing worry-free for my stay during this pendamic.   Moreover, definitely best suite with best & complete view for both KLCC & KL tower in town. Also special thanks W team for the arrangement of upgrading room, superb hearty & top-notch service ever.  Yen Restaurant, a savory cook in KL, certainly another highlight for dining in this city.   Much appreciate with excellent service, Mr Sudhir."
This was to celebrate a special occasion with my partner. Absolutely stunning decorations in room and stylish design. The pool is just spectacular with the view of the twin tower. You would want to take a well posed picture there! Food and drinks are super cheap compared to W in other countries.
"Thank you to WKL Sales/Event/Banquet team for putting up an excellent meeting arrangement for us.  Thank u Fazrin & Farhan from Banquet who took care of all our needs during the event, Lisa & Teoh for helping us put together this event.  We have 13 more training days to spend at WKL. Looking forward to continuous good service in the future."
