"Another Bangkok staycation - so I decided to check out a new property in one of my favorite neighborhoods, Silom.     After I read the TA reviews and saw the incredible prices for the Quarter Silom, I booked using their website.      Check in and out were positive experiences as staff easily communicated in English.    But the reception area is small so I can see that it might get hectic with large groups.     Further, the parking situation is limited for but it’s easily accessible via the BTS or Grab car.     As mentioned the property is new so the room furnishing are very nice and there are plenty of outlets for devices.    They also have mood lighting which was a fun touch.     The bed and bedding are good quality and it was easy to fall asleep quickly.    Strong consistent"
I love this hotel. Everything is new in the perfect hotel. As a French man I can say this is the best hotel hospitality I ever get. Mr Aui check I’m with free upgrade from superior room to delux free of charge. I’m less than 5 mins the check im was done. All the staffs we met at the hotel were so nice and exchanged pleasantries with me. But K Aui did the best for me he knows how to make a guest happy and come back again. He explained to me about the facilities and so on. For me I will visit this hotel whenever UHG have membership card I would like to have it this hotel will make me to have platinum soon. Because I will visit more frequently.  The location is good there’s BTS and MRT Tuk tuk nearby easy access to the hotel. And  also my favorite night club Koi at Sathorn tower is
"Simply a great place delivering fabulous value during this complicated period (March 2021). Perfection location, close to BTS, MRT, Sathorn Pier, local markets.  Wonderful staff, very friendly and helpful - 5-star service! Brand new hotel with  great facilities (swimming pool, spa, fitness center) and a very comfortable room.  There is absolutely nothing at the Quarter Silom that we did not like. Our 4-day stay was perfect, so much so that we already booked another 2 nights for when we are back in Bangkok in a few weeks. Highly recommended +++++"
"After long day with meeting at different workplace..i was tried and i have cancel my flight to back home .suddenly I found this hotel on the website...i book and heading to this hotel by walk becoz is just 5mins walk for business area (Sathon and Silom) ...Yes! Good feeling with warm welcome with the staff smile and speak clearly English.Not disappoint to booked this hotel ..good location in Silom soi 6 easy for access parking and internet..huge gym and close to night life such as Patphong ,Taniya Plaza ...i was great to fuel feel my missing home...Thanks for all staff to make me feel like home❤️"
"I used to stay here for 10 day in January, the hotel was super nice and cheap. Good employees and all are able to speak proper english, this is definitely a plus. Back then the price was around 420baht a night. In March in decided to stay here for 1 night. The price is now about 200 Baht more but the service is still the same. Everything nice, good and super professional. The price is reasonable. The hotel is located near the Si Lom complex with nice restaurants and shops inside. It's close to the lumpini park (15min walking),  close to the Bts Sala Daeng (walking around 8min) and close to the MRT Si Lom (walking around 12min). For short and long stay I can highly recommend the Quarter. With a motorcycle it's only 10min from Asok/ Sukhumvit where the Terminal 21 is located. The"
The hotel is located in the heart of Silom area which is very convenient to get around and lots of good food. Fast and organized check-in process. We had a pleasure stay thanks to great service by khun Beam.
"I have planned to surprise my boss anniversary. Surprisingly, I’ve got a super handful guest service Mr.Aui he help me alot.  It’s really impressive to get a helpful staff without any excuse or condition and make it happen. next chance i might be there again"
"Near my office very convinience located silom road and surawong, hotel is new in the room big smart tv connect to wifi and netflix, walk in early have staff 24 hours. front staff very helpful and friendly khob jai Mr.Aui for service will come back again."
"Amazing stuffs, great swimming pool& facilities. Patrick is probably the best guy in BKK. Always around to help and assist. Beam and Sky also have been helpful & friendly. I hope to seem them again! Must visit"
"A must try experience for friendly-budgey hotel! Came across this property on Agoda with special discount so didn't expect much out of it... Surprisingly it turned out to be a hidden gem!!! This new property is located in Silom area with walking distance to MRT/BTS, local market & shopping mall. Room is very nice & clean providing almost all necessities for my stay. I absolutely enjoy all the facilities from smart tv (Netflix etc.) especially the lighting function that can be switched its color!! So much fun. Pool, Gym, Sauna etc.. what else I can ask more.. The staff are all friendly and service-minded from security, front desk, bellboy and housekeeping. Thank you! The only thing that disturb me is noise from neighbors since wall is quite thin I guess .. There are some shouting"
New hotel everything is new modern design. Lobby is large beautiful sofa.  Near 2 station saladaeng bts and mrt silom shopping mall silom complex chamchuri square samyan mitrtown everything was valued staff friendly and help full thank you khun Aui for take care my stayed.
"All hotel service and facilities are very good have ever stayed in every hotel before. Staffs very helpful with service mind, especially Beam for serving the best accommodation. Will come back soon as soon as possible"
I visited this hotel twice with 2 different locations. First one had no late check-out applied. The second one I booked a Pool-view Superior room for 2 nights. Look what I got. What else can I say literally. Great pool ever!!
Good location. not far from BTS. New and modern hotel. Very good service front desk staff name Mickey help me. Very good facilites especially fitness center and swimmimg pool. The most important thing is cheap! Next time will come again for sure!
I stay was amazing at this place breakfast was tasty and buffet a room was very clean and new I happy to stay here staff was amazing and helpful staff AUI and  pictrick and pit all time well come and care customer service  his helpful us go make planning to shopping good local attractions at bangkok
"New hotel with good location. Near BTS Sala Daeng . Room small, but comfortable and clean. Very friendly and helpfull hotel staff, all of them.  For sure  we will come back to stay here again, if we needed"
"Hotel is new and stylish. The price I got while covid situation is unbelievable 600+ with breakfast. All staff is well trained with excellent  service mind especially the guy named ""Raymond"". He ask me to wash my own container that I bring my own vegetarian dish without my asking for help. Everyone also speak perfect english. The breakfast is various and different everyday for thai food, soup and fruit. Perfect for all. Cleanliness is also great."
I was hooked with the design when I booked in a reasonable! When checked the receptionist and bell man was very helpful and accommodating!   My room was clean and comfy bed. The bathroom was my favorite! I just wish they have more toiletries.   The breakfast buffet has plenty of options you can choose that surely satisfied my tummy. Raymond and all the staff offered an exceptional service! I will surely goin back here!
"Loved the amenities and staff name is NOEY and best they are good serving mine ❤️ .Good location relative to a bunch of landmarks made this a nice last stop for us in Thailand. Housecleaning was excellent, hotel sold cheap bottled water, and their cafe is pretty nice too."
"The staff are exceptional!! They’re so amazing, they go out of their way to make their guests comfortable and pleasant with their warm and kind service. The thing that they take the effort to do for me was awesome. I don’t have enough words to describe the brilliance of them.  The room was quite spacious for couple and it was so clean. Bedding and pillows very comfy. TV channel as Netflix didn’t make me bored to stayed for 2 nights and this hotel also conveniently located to BTS and MRT. I’ll surely come back to this The Quarter Silom again and again."
"It was a truly great stay, very professional and friendly staffs. Excellent hospitality and was upgraded to a better room. Love the bed so comfy and modern design especially with in-room multi color lighting system. Highly recommend! Will come back some other times :)  ATHENA P."
"The design of this hotel is amazing.  Got gimmicks from the exterior, the room and the lobby.  I like the location because it’s walkable to Silom road, BTS, MRT, shopping, and there’re many good restaurants and coffee shops nearby. Cheap rates. Very great value."
"the room were very nice, the staff at restaurant toom, tarr, front staff was very attentive.................. will definitely come.back.here.for stay. though there still.some.works.going on but it.didnt.disturb me."
"Another Bangkok staycation - so I decided to check out a new property in one of my favorite neighborhoods, Silom.     After I read the TA reviews and saw the incredible prices for the Quarter Silom, I booked using their website.      Check in and out were positive experiences as staff easily communicated in English.    But the reception area is small so I can see that it might get hectic with large groups.     Further, the parking situation is limited for but it’s easily accessible via the BTS or Grab car.     As mentioned the property is new so the room furnishing are very nice and there are plenty of outlets for devices.    They also have mood lighting which was a fun touch.     The bed and bedding are good quality and it was easy to fall asleep quickly.    Strong consistent"
I love this hotel. Everything is new in the perfect hotel. As a French man I can say this is the best hotel hospitality I ever get. Mr Aui check I’m with free upgrade from superior room to delux free of charge. I’m less than 5 mins the check im was done. All the staffs we met at the hotel were so nice and exchanged pleasantries with me. But K Aui did the best for me he knows how to make a guest happy and come back again. He explained to me about the facilities and so on. For me I will visit this hotel whenever UHG have membership card I would like to have it this hotel will make me to have platinum soon. Because I will visit more frequently.  The location is good there’s BTS and MRT Tuk tuk nearby easy access to the hotel. And  also my favorite night club Koi at Sathorn tower is
"Simply a great place delivering fabulous value during this complicated period (March 2021). Perfection location, close to BTS, MRT, Sathorn Pier, local markets.  Wonderful staff, very friendly and helpful - 5-star service! Brand new hotel with  great facilities (swimming pool, spa, fitness center) and a very comfortable room.  There is absolutely nothing at the Quarter Silom that we did not like. Our 4-day stay was perfect, so much so that we already booked another 2 nights for when we are back in Bangkok in a few weeks. Highly recommended +++++"
"After long day with meeting at different workplace..i was tried and i have cancel my flight to back home .suddenly I found this hotel on the website...i book and heading to this hotel by walk becoz is just 5mins walk for business area (Sathon and Silom) ...Yes! Good feeling with warm welcome with the staff smile and speak clearly English.Not disappoint to booked this hotel ..good location in Silom soi 6 easy for access parking and internet..huge gym and close to night life such as Patphong ,Taniya Plaza ...i was great to fuel feel my missing home...Thanks for all staff to make me feel like home❤️"
"I used to stay here for 10 day in January, the hotel was super nice and cheap. Good employees and all are able to speak proper english, this is definitely a plus. Back then the price was around 420baht a night. In March in decided to stay here for 1 night. The price is now about 200 Baht more but the service is still the same. Everything nice, good and super professional. The price is reasonable. The hotel is located near the Si Lom complex with nice restaurants and shops inside. It's close to the lumpini park (15min walking),  close to the Bts Sala Daeng (walking around 8min) and close to the MRT Si Lom (walking around 12min). For short and long stay I can highly recommend the Quarter. With a motorcycle it's only 10min from Asok/ Sukhumvit where the Terminal 21 is located. The"
"Another Bangkok staycation - so I decided to check out a new property in one of my favorite neighborhoods, Silom.     After I read the TA reviews and saw the incredible prices for the Quarter Silom, I booked using their website.      Check in and out were positive experiences as staff easily communicated in English.    But the reception area is small so I can see that it might get hectic with large groups.     Further, the parking situation is limited for but it’s easily accessible via the BTS or Grab car.     As mentioned the property is new so the room furnishing are very nice and there are plenty of outlets for devices.    They also have mood lighting which was a fun touch.     The bed and bedding are good quality and it was easy to fall asleep quickly.    Strong consistent"
I love this hotel. Everything is new in the perfect hotel. As a French man I can say this is the best hotel hospitality I ever get. Mr Aui check I’m with free upgrade from superior room to delux free of charge. I’m less than 5 mins the check im was done. All the staffs we met at the hotel were so nice and exchanged pleasantries with me. But K Aui did the best for me he knows how to make a guest happy and come back again. He explained to me about the facilities and so on. For me I will visit this hotel whenever UHG have membership card I would like to have it this hotel will make me to have platinum soon. Because I will visit more frequently.  The location is good there’s BTS and MRT Tuk tuk nearby easy access to the hotel. And  also my favorite night club Koi at Sathorn tower is
"Simply a great place delivering fabulous value during this complicated period (March 2021). Perfection location, close to BTS, MRT, Sathorn Pier, local markets.  Wonderful staff, very friendly and helpful - 5-star service! Brand new hotel with  great facilities (swimming pool, spa, fitness center) and a very comfortable room.  There is absolutely nothing at the Quarter Silom that we did not like. Our 4-day stay was perfect, so much so that we already booked another 2 nights for when we are back in Bangkok in a few weeks. Highly recommended +++++"
"After long day with meeting at different workplace..i was tried and i have cancel my flight to back home .suddenly I found this hotel on the website...i book and heading to this hotel by walk becoz is just 5mins walk for business area (Sathon and Silom) ...Yes! Good feeling with warm welcome with the staff smile and speak clearly English.Not disappoint to booked this hotel ..good location in Silom soi 6 easy for access parking and internet..huge gym and close to night life such as Patphong ,Taniya Plaza ...i was great to fuel feel my missing home...Thanks for all staff to make me feel like home❤️"
"I used to stay here for 10 day in January, the hotel was super nice and cheap. Good employees and all are able to speak proper english, this is definitely a plus. Back then the price was around 420baht a night. In March in decided to stay here for 1 night. The price is now about 200 Baht more but the service is still the same. Everything nice, good and super professional. The price is reasonable. The hotel is located near the Si Lom complex with nice restaurants and shops inside. It's close to the lumpini park (15min walking),  close to the Bts Sala Daeng (walking around 8min) and close to the MRT Si Lom (walking around 12min). For short and long stay I can highly recommend the Quarter. With a motorcycle it's only 10min from Asok/ Sukhumvit where the Terminal 21 is located. The"
"Another Bangkok staycation - so I decided to check out a new property in one of my favorite neighborhoods, Silom.     After I read the TA reviews and saw the incredible prices for the Quarter Silom, I booked using their website.      Check in and out were positive experiences as staff easily communicated in English.    But the reception area is small so I can see that it might get hectic with large groups.     Further, the parking situation is limited for but it’s easily accessible via the BTS or Grab car.     As mentioned the property is new so the room furnishing are very nice and there are plenty of outlets for devices.    They also have mood lighting which was a fun touch.     The bed and bedding are good quality and it was easy to fall asleep quickly.    Strong consistent"
I love this hotel. Everything is new in the perfect hotel. As a French man I can say this is the best hotel hospitality I ever get. Mr Aui check I’m with free upgrade from superior room to delux free of charge. I’m less than 5 mins the check im was done. All the staffs we met at the hotel were so nice and exchanged pleasantries with me. But K Aui did the best for me he knows how to make a guest happy and come back again. He explained to me about the facilities and so on. For me I will visit this hotel whenever UHG have membership card I would like to have it this hotel will make me to have platinum soon. Because I will visit more frequently.  The location is good there’s BTS and MRT Tuk tuk nearby easy access to the hotel. And  also my favorite night club Koi at Sathorn tower is
"Simply a great place delivering fabulous value during this complicated period (March 2021). Perfection location, close to BTS, MRT, Sathorn Pier, local markets.  Wonderful staff, very friendly and helpful - 5-star service! Brand new hotel with  great facilities (swimming pool, spa, fitness center) and a very comfortable room.  There is absolutely nothing at the Quarter Silom that we did not like. Our 4-day stay was perfect, so much so that we already booked another 2 nights for when we are back in Bangkok in a few weeks. Highly recommended +++++"
"After long day with meeting at different workplace..i was tried and i have cancel my flight to back home .suddenly I found this hotel on the website...i book and heading to this hotel by walk becoz is just 5mins walk for business area (Sathon and Silom) ...Yes! Good feeling with warm welcome with the staff smile and speak clearly English.Not disappoint to booked this hotel ..good location in Silom soi 6 easy for access parking and internet..huge gym and close to night life such as Patphong ,Taniya Plaza ...i was great to fuel feel my missing home...Thanks for all staff to make me feel like home❤️"
"I used to stay here for 10 day in January, the hotel was super nice and cheap. Good employees and all are able to speak proper english, this is definitely a plus. Back then the price was around 420baht a night. In March in decided to stay here for 1 night. The price is now about 200 Baht more but the service is still the same. Everything nice, good and super professional. The price is reasonable. The hotel is located near the Si Lom complex with nice restaurants and shops inside. It's close to the lumpini park (15min walking),  close to the Bts Sala Daeng (walking around 8min) and close to the MRT Si Lom (walking around 12min). For short and long stay I can highly recommend the Quarter. With a motorcycle it's only 10min from Asok/ Sukhumvit where the Terminal 21 is located. The"
"Another Bangkok staycation - so I decided to check out a new property in one of my favorite neighborhoods, Silom.     After I read the TA reviews and saw the incredible prices for the Quarter Silom, I booked using their website.      Check in and out were positive experiences as staff easily communicated in English.    But the reception area is small so I can see that it might get hectic with large groups.     Further, the parking situation is limited for but it’s easily accessible via the BTS or Grab car.     As mentioned the property is new so the room furnishing are very nice and there are plenty of outlets for devices.    They also have mood lighting which was a fun touch.     The bed and bedding are good quality and it was easy to fall asleep quickly.    Strong consistent"
I love this hotel. Everything is new in the perfect hotel. As a French man I can say this is the best hotel hospitality I ever get. Mr Aui check I’m with free upgrade from superior room to delux free of charge. I’m less than 5 mins the check im was done. All the staffs we met at the hotel were so nice and exchanged pleasantries with me. But K Aui did the best for me he knows how to make a guest happy and come back again. He explained to me about the facilities and so on. For me I will visit this hotel whenever UHG have membership card I would like to have it this hotel will make me to have platinum soon. Because I will visit more frequently.  The location is good there’s BTS and MRT Tuk tuk nearby easy access to the hotel. And  also my favorite night club Koi at Sathorn tower is
"Simply a great place delivering fabulous value during this complicated period (March 2021). Perfection location, close to BTS, MRT, Sathorn Pier, local markets.  Wonderful staff, very friendly and helpful - 5-star service! Brand new hotel with  great facilities (swimming pool, spa, fitness center) and a very comfortable room.  There is absolutely nothing at the Quarter Silom that we did not like. Our 4-day stay was perfect, so much so that we already booked another 2 nights for when we are back in Bangkok in a few weeks. Highly recommended +++++"
"After long day with meeting at different workplace..i was tried and i have cancel my flight to back home .suddenly I found this hotel on the website...i book and heading to this hotel by walk becoz is just 5mins walk for business area (Sathon and Silom) ...Yes! Good feeling with warm welcome with the staff smile and speak clearly English.Not disappoint to booked this hotel ..good location in Silom soi 6 easy for access parking and internet..huge gym and close to night life such as Patphong ,Taniya Plaza ...i was great to fuel feel my missing home...Thanks for all staff to make me feel like home❤️"
"I used to stay here for 10 day in January, the hotel was super nice and cheap. Good employees and all are able to speak proper english, this is definitely a plus. Back then the price was around 420baht a night. In March in decided to stay here for 1 night. The price is now about 200 Baht more but the service is still the same. Everything nice, good and super professional. The price is reasonable. The hotel is located near the Si Lom complex with nice restaurants and shops inside. It's close to the lumpini park (15min walking),  close to the Bts Sala Daeng (walking around 8min) and close to the MRT Si Lom (walking around 12min). For short and long stay I can highly recommend the Quarter. With a motorcycle it's only 10min from Asok/ Sukhumvit where the Terminal 21 is located. The"
"Another Bangkok staycation - so I decided to check out a new property in one of my favorite neighborhoods, Silom.     After I read the TA reviews and saw the incredible prices for the Quarter Silom, I booked using their website.      Check in and out were positive experiences as staff easily communicated in English.    But the reception area is small so I can see that it might get hectic with large groups.     Further, the parking situation is limited for but it’s easily accessible via the BTS or Grab car.     As mentioned the property is new so the room furnishing are very nice and there are plenty of outlets for devices.    They also have mood lighting which was a fun touch.     The bed and bedding are good quality and it was easy to fall asleep quickly.    Strong consistent"
I love this hotel. Everything is new in the perfect hotel. As a French man I can say this is the best hotel hospitality I ever get. Mr Aui check I’m with free upgrade from superior room to delux free of charge. I’m less than 5 mins the check im was done. All the staffs we met at the hotel were so nice and exchanged pleasantries with me. But K Aui did the best for me he knows how to make a guest happy and come back again. He explained to me about the facilities and so on. For me I will visit this hotel whenever UHG have membership card I would like to have it this hotel will make me to have platinum soon. Because I will visit more frequently.  The location is good there’s BTS and MRT Tuk tuk nearby easy access to the hotel. And  also my favorite night club Koi at Sathorn tower is
"Simply a great place delivering fabulous value during this complicated period (March 2021). Perfection location, close to BTS, MRT, Sathorn Pier, local markets.  Wonderful staff, very friendly and helpful - 5-star service! Brand new hotel with  great facilities (swimming pool, spa, fitness center) and a very comfortable room.  There is absolutely nothing at the Quarter Silom that we did not like. Our 4-day stay was perfect, so much so that we already booked another 2 nights for when we are back in Bangkok in a few weeks. Highly recommended +++++"
