"Me and my friends visited this rooftop bar called “VIEW”, it’s in the 9th floor of Novotel Platinum. We had their signature cocktails and it was amazing specially “The Parch” that been recommended by Garfield. All in all, we had an amazing experience. The staff was accommodating and the view was spectacular. A must visit place!"
Me and my friends booked a two days staycation in Novotel Pratunam!  We are overwhelmed with the hospitality of the receptionist name MARK he was so accommodating and was very helpful/ we surely be back again.
"Novotel bar in pratunam, is a place to have a good time, good food, good drinks, and excellent service. Thanks to Garfield thai bartender and as well james filipino.I enjoyed it so much.I would really recommend it to my friends and everyone.I will be coming back."
Garfield and Alex in Bar area are so awesome. Very accommodating and funny. You should come here too. Good food and nice drinks. I love the place verg relaxing and they hotel has the nice spot for nice views here in the hear of Bangkok. Thank you Novotel😘😘😘.
"Nice BKK View.   Nice vibes, and good service 👍👍👍👍👍good drinks.🍻🍹🍸🍺 I will be back again soon. So cute cocktail and polite staff!!!!! ☺️☺️☺️☺️☺️I went here few years ago and back this time all service still goods 👍"
"I visited the View Bangkok many times.Everyone takes care us like family same as the first time such K.Nanzy, K.Alex and K.Cheek, they’re very nice staff. For the food and drink and also view always the best"
"Nice staff by Nancy and Alex. I have a good view, when we need to relax , this place gave me good feel. Next time I will come with my couple again, she really love this place, also my friend . City view is also the best place to came."
"Being on my own for a business trip, it was especially nice  that the hotel pool staff were so attentive and supportive without over selling, Garfield and Alex were attentive, helpful, and kind. If they are examples ofThai people, I am confident that the rest of my stay here will be wonderful! Thank you Novotel Platinum for a great pool and great staff.  Kitti Pratt"
It is the fiest one bar I visited imn my travel in Bangkok. THE bar is so fabulous withvarious type of drinks . I FEEL Happy when I have arrived here with the quality of drink and food and with the servie. And I would like appreciate Mr.Garfild and Mr. ALEX FOR my convenience
The bar is so fabulous with various cocktails and mock tails . They even have their own sights spot Bangkok city view. I feel happy when I have arrived here. It is so good with the quality of drinks. At last I would like to appreciate Mr. Garfild and Mr. Alex for my convenience.
"On 23  March 2021 ,  I celebrate by birthday  here  BAKKOK  VEIW where you can see the city view of bankkok  .  The    drinks would be provided by   Nice staff as Alex , Nan Garfew . Everyone service  from their heart seems like I am one of their family Thanks so much"
"My first experience here is so impressive. Good atmosphere, very good service from all staff. Music also nice.Would highly recommend to other frinds. Thank you Nancy, Alex and Garfield for very warm take care."
"Good customer service and great food! Love here, I’ll tell all my friends to visit here at least once. For me, I’ll come here every week lol seriously, here is the best place to suggest your friends :3"
"The staffs are very generous! I requested him so many things and there was a word no from them! With a smiley face and perfect service mind! Love it! Totally worth it!  You can smoke here, bubble sofa here, sitting by the pool, what else would you possibly need?"
Very nice and cool ambience relaxing place specially if uou come from work.            The staff recommed drinks for me it was a good lovely taste!!! A very reasonable price and good food its amazing^^ Kudos to Nancy and Garfield for good and ver hospitable
"The staff are very attentive, always asking what help is needed. Always invited to talk Spaghetti Carbonara is very delicious. Excellent atmosphere with views of Central World. Thank khun gafiew,khun alex"
"Very welcoming staff and very kind! The staff in the morning his name is Mark who assisting us very great and very polite give us a good impression, also the trainee Oil is also good and helping us! The service is very impressive i must say! We will return in this hotel for sure!"
"Delicious food and wonderful drinks. Staffs are nice and friendly.  It is very special Friday night time  here.  Stunning view in the middle of city, Bangkok. So enjoy the drinks with friends. Love it !!"
"Garfield, Nancy and Alex they’re such a great service and cheerful bartenders. Got an excellent experience with friends here . Special drink and special atmosphere!!! I would love to be here with my lovely friend again ❤️❤️❤️❤️"
I've booked this hotel for two nice because near the office of one of my customer. The structure is very beautiful and clean with very professional staff. The room is huge with a very nice toilet. Next time I will be around here I will come back
"Its been a while since my last visit to bars of bangkok since the implementation of alcohol ban, i thought it will be an epic experience to visit bars during this time, its my second time to visit view bar bangkok and im so fascinated with the view from this bar,city lights and ambiance is so mesmerizing. This is a must see place to relax, my mocktails made by very lovely staff Mr.James and Mr.Garfield is so perfectly blend together with the bar manager. Their service and dedication to work is exceptional. Thanks to them. Thank you Novotel. Looking forward on my third visit,hopefully my long island can be serve😊"
"I come at the bar for relaxing with the sunset very nice ambience and good service staff, thank you for good service James and Garfield!  I come again to celebrate special occasions here at the bar with friends."
"Always they meet my expectation bar staff is the best among the rest! I love the combo set!Nan,garfield and James are good team! I will definitely come again and recommend this view rooftop bar in my friends and family!"
"It’s a great place to enjoy with your friends.  Just chill, eat , enjoy the music, the ambiance. By the time we came there’s still a restriction on selling alcoholic beverages (because of Pandemic) nevertheless we did enjoy our food and drinks (smoothies)there!. Thank you Mark for guiding and helping us (He’s the best!) and to Nancy for being attentive and for making us special. (It’s like our private place 😊🥰) We will come back for sure! See you again view roof top bar. Thank you!"
"Only spent 1 night but simply put, a great room with a super comfortable bed.. location was perfect and had all the facilites one needs. The team was helpful and everything was overall just really nice.  even had a little turn down note and cake from the manger. :) Thanks"
the overall experience was 11/10. Stayed in a room with an awesome city view.. Very accomodating staff.. Big Thanks to Sir Mark whose been so friendly and very helpful through out our stay.. They have been so strict in observing   safety measures even during pandemic. Thank you so much! Had great time!! Will surely come back!
"We had a lovely family new year day stay at Novotel Bangkok Platinum Hotel. All facilities and in-room amenities of the hotel are excellent not to mention the fantastic service extended to us by ""Mr. Mark"" the manger in the Reception area. He is an asset, truly accommodating and attentive tour queries and requests. Thanks again and will surely come back and recommend this hotel."
"I came with my family for New Year celebration, and we choose Novotel pratunam to be our first day staying a hotel for 2021, and the view rooftop bar makes us complete our stay! Many thanks to James and Garfiled for nice and very hospitable to us! I will definitely comeback 💕😍"
"🎄🥳A place to relax and enjoy. Friendly and accomodating staffs. Very convenient to Pratunam Malls, Airport link and BTS #staycation #HappyPeopleDon'tComplain #FunHoliday #Memories #CheerstoMoreYearsNovotel 🥂👏"
"Good accommodations, staff and crews are polite, cleanliness, overall my vacation in your hotel!!!  I will recommend this Novotel to my friends and relatives in the Philippines 🇵🇭 and abroad!!! 🤩⭐️⭐️⭐️⭐️⭐️🤩"
"The rooms were clean. Love the infinity pool beside the bar. Buffet breakfast was good. The staff were nice especially their front desk officer, Mark who was very approachable. We'll definitely visit the place again!"
"We absolutely enjoyed our stay at Novotel. Breakfast was great and the hotel was clean and perfectly situated in the middle of Pratunam. We loved the pool on the rooftop. Big shopping malls such as Platinum, Siam Paragon, Central were all just a few steps away. Mr Mark Reyes at front desk has been great assisting us in every possible way making sure we enjoyed our stay. We are defo coming back!"
I'm in Bangkok for business and normally I have my accommodation but for a case I had to sleep one night in hotel. I choosed this one because close to my house. The room is very comfortable and everything in perfect conditions. At the reception the staff is been very polite.
"Me and my boyfriend went to this rooftop bar, Garfield and james welcome us with a warm greetings. Mark also at reception intro this wonderful bar. When we arrived he welcome us also even we dont have booking, they follow also social distancing during this covid situation."
This s a very beautiful hotel with huge room and amazing view from the windows. It is also possible get a swim in the panoramic swimming pool. The staff is very professional and friendly as well. This is very nice hotel where to stay
"I think the food tastes good. And easy to drink cocktails But may be a little too sour But all in all, it's good. As for the staff, they are very cute and have fun talking. And this place have a beautiful view same this bar. Thank you nan few p & bike"
Superb set of of beffet and great service. Location is near at centrak world also lije to mention Mark for the great service of him he really taking care of us! Surely we will come back here again and surely we will share this information to my friends!
This is my not my first time and yet they always meet my expectations.  View rooftop bar is a friendly and very hospitable staff in novotel bangkok platinum. I want to thanks James and garfiled for good everything that make me happy. The trainee Pee and bic also for good take care. I always come here! Recommended!
This bar have amazing staffs and great atmosphere.  Nan was a great manager and friendly.   You can enjoy and have a good time here.   The promotion   Free flow beer & cocktail for 2 hours only 699++   Awesome   Cheers
I came here so many time with my friend and the view still amazing. Bartender Garfield and Nancy very good service they are always take care  and talking to us. Food and drink all amazing taste. I’ll definitely come back again for sure.  Thank you Garfield and Nancy 😍
"Novotel Bangkok Platinum Pratunam locates literary few steps away from the Central World and Siam Square area. Extremely convenient location with easy access to all the glitterings Bangkok is famous for. Room is quite spacious with a great view overlooking the sleepless streets. My stay was made possible thanks to Ms. Rachaporn’s (Reservation) professional and immediate assistance and the whole experience was elevated to another level because of Mr. Q and Mr. New’s (Front Office) warm service. Mr. Q verified my last-minute booking in an efficient manner, and introduced me to the features of this property. It was rare to encounter this level of service at a city hotel. One can tell Mr. Q really enjoys his work and he is definitely an essential asset to the team. Special shout-out"
"A good place to hangout while staying in Novotel Platinum. The bar located on FL.9 of the hotel next to swimming pool. Nice music and view overlooking to the Park (next to CTW). Thank you Garfield and James for providing a good taking care, giving me a good recognition every time I return."
"Cocktails so good 😊, I like that very nice 👍🏻  Good service. Staff very nice. Thank you for my holiday, it’s happy my time. VIEW Bangkok @Novotel Bangkok Platinum Pratunam nice view , everyone can see view Central World"
The staffs were great. Garfield is very accommodating and I like how he served us.he is very professionalm Nancy is very helpful. I like to thank the cook for the best foods served for me. I like to get back here. The place is also relaxing.
Must visit this place! So lit and adorable friendly staff. GARFIEL AND NANCY has a good service with us.they suggest good drinks and good food prepared by chef pangs. If you will hang out in Bangkok you must visit this place. Thanks also to Mark who welcome us in reception and guide us going to this rooftop bar.
"Novotel Bangkok Platinum   Shout out to Sir James, Sir Garfield and Sir Mark for welcoming us warmly. It was an awesome staycation for us. We’d want to come back again! One more thing, the drinks!!! Loveee it! Much recommended!!!!!!"
"My friends and I stayed in “View Rooftop Bar” and we had a great time there! The facility was good, place was super cozy, music is relaxing, drinks were delicious as well and I wanna mention the staff who assisted us during our stay. They are “James”, “Garfiled” and “Mark”. They are very accommodating, we felt so welcome and they gave us superb experience during our stay. We will surely comeback here on our next staycation!"
We really had a great experience. The staff were very friendly and accommodating. The room is clean and they have provided us with extra robes and basically anything we need is just a call away. It’s so good to wake up with a good view of the city. I highly recommend to have a staycation here.
"Every staff we met was so nice and accommodating. Especially Mark, James and Garfield! We felt so welcomed! Mark is so nice to recommend the rooftop bar. You can enjoy the view with a nice drink. Thank you for making us feel at home. Nice music too. 😁😁😁"
"If you're for a really comfy bed this is the place for you! If you're looking forward to a wonderful breakfast you'll be disappointed. If you're hoping to enjoy the benefits of the executive wing don't do it! It's just not worth the money. I booked 2 rooms on the executive floor hoping to simply unwind and enjoy but alas, with only 2 different ""snacks"" to choose from (both of which were very cold!) and a limited stock of drinks and an uninviting area (very small & cramped I might add) it was such a disappointment we never went back to the lounge. The real plus, though, on the executive floor were our rooms (both corner rooms)! They were spacious and the bathroom had a his & hers basin, a bathtub, a seperate shower room and a separate toilet. If you're simply wanting to enjoy the"
Travelling from sriracha down to the city bangkok and i came up to viewrooftop bar for relax before i go back to my hometown! The place was very relaxing and the ambience with bossa nova music was perfect!thanks to Nanny and James for good taking care of me and also mark for good information! Excellent!!
Very good for an atmosphere and service too much. Next time I will comes with friends and family for sure! Thanks to the frindly staff of bar!good drinks  with good view they have signature drinks that u can only try on this bar!
Come to celebrate birthday to rooftopbar at view bkk and the hospitality of the staff was so amazing!they made my day more special!!thanks to James and garfiled very nice man!!! Good place and nice spot for friends and family! Recommended!!
Had so much fun having my chill time on Novotel Platinum  Pratunam’s bar View Bangkok. Garfield and James are so professional and fun. They made sure that we are well catered and accommodated. The food and drinks are all good and are priced reasonably. This is a great spot to have fun and chill in the heart of Bangkok.
"The best bar in bangkok during covid-19, me and my friend was having nightlife in bangkok during this time, however we found out this bar and they offer great drinks with a great service staff name garfield! He offer us best drinks and we had so much fun."
"I'm normally reluctant to 5 star an experience but for this hotel I'll make an exception.  Service: friendly and professional.  Room: we booked a ""king suite', and it was simply a dream...Totally unfaultable...Everything top quality...The stylish bathroom, the lounge with its own TV, the bedroom superb and a view through the panoramic windows to kill for.  The breakfast: scrumptious with multiple choices (including Marmite!) and wonderful coffee.  Also, with this particular room came the feature of free wine, beer and canapés in the early evening.  Check in and out: uneventful.  So good overall that we're booking the Siam Square Hotel in a couple of weeks..."
"This view in bangkok was so good, while we talk about bangkok. This bar is always the best for me. Because a drink prices are bot too expensive. On others hand, the views of this bar is so nice according to this bar places at the hub of bangkok so you can see the city views. In addition, the taste of drink are so nice and the staffs are very nice service too for example, Khun nan and Kafew. So I will come back again on next time moreover I will reccommend it to my friends."
"Excellent hospitality, location, excellent hotel. We experienced extreme comfort. Highly recommended. Thanks Miss Fon for your warm welcome and assistance everytime we needed your help. You made our stay very comfortable. You really deserve to be at the front desk. Thank you so much. To Mr. Mark for his kind assistance during our check out, thanks."
เป็นโรงแรมที่ได้มีโอกาสมาพัก ผมจองเป็นห้อง Executive suite with a separate living room and 1 king size bed โดยห้องนี้รวม executive lounge มีafternoon tea กับ evening free flow ให้ด้วย ตอนผมมาค่อนข้างเย็นแล้ว จึงได้มีโอกาสไปนั่งตอนเย็น มีแค่ไวน์ เบียร์ และsoft drink แต่cock tail ไม่มี ขนมมี 2 อย่าง อาหารมี 2 อย่าง แล้วเย็นจืดชืด ไม่อร่อย เอาเป็นว่าจองเป็นห้องธรรมดาไม่ต้องมีloungeก็ได้ครับ มาอีกครั้งคงไม่ใช้อีก  ส่วนห้องพักดีมากกกก คุ้มค่าราคามาก ห้องใหญ่มาเหมือนพักได้ 3-4 คนเลย ห้องนั่งเล่นแยกออกมา มีโซฟา มีโต๊ะทำงาน ห้องน้ำมีสองห้อง แยกกันใช้ได้เลย ซิ้งล้างหน้าเป็นแบบคู่ มีอ่างอาบน้ำ วิวห้อง หันไปทาง central world เอาเป็นว่าคุ้มค่าราคาที่ห้องเนี่ยแหละครับ
"Such a great lovely place at centre of bangkok, super friendly staff and very good drinks, fast services and awesome foods. Just reserve before you visit.resonable price. Come along with friend or family, they would love it"
It's very nice. For signature cocktail I recommend jarhead and the parch. For food I recommend Cashew chicken. I think when you stay in Bangkok You should tyr it. The last owner very kind and very good service.
"It's wonderfuland and friendly staffs(Garfield & Nancy),very nice cocktails and good promotions here.kids all enjoy swimming while we have a chat.Our family very happy to spending time together here 🥰."
"Great drinks (very long happy hour with 2 for 1 cocktails!), nice view at night time and lovely service. I recommend this spot! It is right next to centralworld so it is easy to get to and would be a great place to visit after a shopping trip (or if you're staying at the Novotel Pratnaum, as I was). Thank you :)"
"The room was perfect, the services were by far one of the best I had experienced. The view from our room was amazing. I really love the bathroom with big bath tub.  Thank you Mr. Mark Reyes for a warm welcome and providing the best hotel experience in Bangkok."
"The hotel is just a walking distance to Central World and BTS Siam station. Mr. Mark Reyes, the one who checked us in, was very warm and accommodating. He really knows how to receive guests and make them comfortable. In fact, I got a room upgrade from standard room to executive suite room."
We enjoyed our stay at Novotel Bangkok Platinum Pratunam - SHA Certified. We were accommodated by the front desk officer Mark Reyes and he's very welcoming and hands on. Our room is so elegant with the hightech toilet glasswindow and it has wonderful view of the city.
Novotel bar’s drinks are so delicious and tasty. I have ordered Blushed. Main ingredient is watermelon and alcohol.  เครื่องดื่มของบาร์โรงแรมโนโวเทลอร่อยและรสชาติดีมาก ผมสั่งเครื่องดื่มชื่อว่า Blushed โดยมีส่วนผสมหลักคือแตงโมและแอลกอฮอล์
This restaurant has good view you can see view of Bangkok.Delicious drinks you can tell what taste do you want .They will make it special.The price isn’t too expensive. I think this place is a good choice to relax.
This is the best bar!! Food dirnk and service is VERY NICE!!! I LIKE THIS BAR SO much!!! Thank you for ms.Nan and bar mr. Gafild. That guys so amazing service. I promise I'll coming back this bar again!!!   It too bad for open 3 days only fri-sun day.  But I LOVE THIS BAR!!! :)
"While I was in here during the COVID-19 Pandemic, I enjoyed the music here. They play house music, so if you are into that it’s great. The food is nice and the cocktails are great. It’s also very easy to get to, as it is accessible to all the 3 train routes. You can even get here by the Airport Rail Link. Not to mention it is also right next to Central World, a major destination. It’s also directly connected to the Novotel Hotel, so if you are staying there, it is as easy as turning left at the reception.  The cocktails are reasonably priced. They are priced a bit higher than other places but since you are situated right in the heart of Bangkok (literally next to Central World and to some extent Siam Discovery / Siam Center) it’s reasonable to be charged some extra to get that"
"This review marks the 7th stay with this hotel. It's a perfect location (without the need to take a BTS) for shopping and dining! Surrounded by all famous malls, wholesale pratunam market, restaurants, massages and famous SabX2 Wanton Noodles just mins walk away. Pleasant service and rooms are always well kept. Buffet breakfast is a nice delight as well with a good variety. Needless to say, I will be coming back again!"
"Very nice cocktail and very good service thanks you Garfield and Manager Nancy is kind and lovely she so attentive to served us, Mark also for helping us! The bar and the hotel is really in prime location and easy access to shopping mall like in Platinum mall, Central world,Big C and the new one The Market!"
"Dinner times with my gril friend, i feel welcome here in bangkok at Novotel Platinum   Cocktail is very good testing i will be recomment to came here this place, music is chill and thanks you Nancy and Garfield for good take care, i will be back again."
"I came here with my friends this rooftop bar is very chill and good take care by Manager Nancy, she are friendly and highly knowledgeable wine, I recommend this place when are you came in bangkok THANKS U Mr. Garfield for good take care and very nice cocktails ❤️"
"Hi I hd visited view Bangkok 4 peoples  with my family. Nice view nice staff k nan, k Alex, k Garfield , who take care us with the beautiful smile. Hope to come here very soon. Thank you for take care us."
"This is My first time here at view Bankkok in Novotel,it amazing and wonderful bar here you can see the Bankkok city and enjoy swimming pool  As the great staff ( gafew, Nan) they can provide drinks perfectly"
Dinks were super original and really great^^ Free flow promotion is a great deal for the quality of drinks and the amazing view of the city. Wish we could come back every night!!! Nancy and Garfield was awesome very helpful and courteous. They made our night even better 😍😍😍
"As the kindest reception ""Mr.mark"" and helpful he gave us the happiest while we were in the hotel.  They have the premium loungh that we could leave our baby to run around  with the safety zone and beautiful bangkok skyview.  For the room they fave us the 24thfloor room almoat the top floor with the wonderful view.  The room quite new and clean. We were happy all the time when we stay there."
