"This was our first time to stay here and my family and I had the most pleasant stayed,,,truly!!   The location is ideal for shopping (happy girl^^) and my impressed was begun once the time of checking in,,my self phone was left on a limousine service, The Bell boy (sorry to ask for your name but you are the afternoon shift on 04 Oct 2020) suddenly tried to contact the limousine company to get my phone back, thank you very much^^.   Khun Mark and Khun Nat provided the best hospitality service during our stay and the smooth check in and out, they are super friendly to my daughter also my aunt, took care of everything we need and every essential information we asked for.  I loved how the hotel cares for the hygiene(especially in this situation) the rooms were very clean and you"
We stayed here for one night only and the staff give us free upgrade and he is so kind to us! Thank you mark!  The location is really good and near to shopping center and walking distance to central world
"I’ve visit the view for the second time and Ice , Garfield and Nancy are nice and entertaining. They are helping me to choose a drink and explain. I would definitely come back and highly recommend for everyone. If your are looking for a nice place and nice staff."
"I’ve been staying in this hotel few months ago, At 23th floor, and the view of bangkok city is totally amazing and perfect. Facility is totally perfect. Service is perfect,  Hope i can go back to Bangkok city and stay im here again"
"I have been there since 5-7September 2020 in Bangkok. Khun Nat and Khun Gus, they are front desk at night shift was so nice and good service. The hotel very nice, i stayed at 23th floor with very nice view of Bangkok."
"Good service check in!good rooms and very hospitable staff name mark,James they both good and cery friendly! The hotel is really in good location and easy access to Platinum mall and Central world.. we will come here again..."
"I came with the family, the hotel is amazing located in the bangkok. Khun gus at the reception so awesome and very polite he really good take care and good service mind. Definitely, we come back again !!"
"The place is good and saw our kababayan (James and Mark). Very accommodating and very welcoming. If you (Filipino or foreigner) want to visit Bangkok and looking for a place to stay, I recommend you this place.  PS. I would like to say Thank you to the man (I forgot to get his name) in concierge for helping us and giving us mask when we forgot to bring ours.   Looking for our next adventure."
"My first time visit to this hotel with my family, m very happy with the stay. We stayed between 16 March till 19th March. Suggest taking a grab car from the airport. We booked a family room that come with the bunk bed. Room is quite spacious with comfy bed. My kids love the bunk bed because there is some soft toys. Location is very good, connected to shopping mall. Nearby fast food like MCD, Burger king, A&W and etc. Food court located in the shopping mall top floor. Money changer, atm and massage parlors is also walking distance. I was lucky during that period there is a street food stall right outside the hotel. No shortage of food choice. Train station is quite a walking distance (10-15 minute) Sight seeing location is not far off like Wat Arun/Wat Pho. Can also use grab car"
"Staff are very funny. And are pushing me to do this in order for me to get my drink. It’s worth it. Also, they’ve been wonderful overall. Breakfast is lovely. The lounge area on the 6th floor has floor-to-ceiling windows with great views of the neighbourhood."
"Recommend. Specially Mark was very helpful.  Rooms are very nice  Everything works perfectly. Hotel lovbu is nice place to spend time.  Location is very good, near everything  To Bts only 5 minutes walk.  V"
"Needless to say,the view bangkok rooftop bar is the best bar in Bangkok.The signature drink so wonderful such as The Blushes etc.And the important thing they have a great service.Mild and Garfield really really amazing team in rooftop bar.They alway entertain guest all the time when they busy but they still smile and playful.   If you want to see the best view come here to join at VIEW BANGKOK ROOFTOP BAR"
"Good bar with great views over the city , 500 baht for unlimited drinks can't go wrong. Friendly staff with good service .Mild and Garfield and Lion really great service and helpful.I will recommend for our friends"
"My last visit to the hotel was five years ago. This hotel is still recommended. The staff is very friendly and fulfills all wishes.  You can end the evening at the pool bar, where you can still swim in the pool during the day. In the Lounge or in the view Bar ""Ice"" is very nice and the service is very good. The Barkeeper is the No. 1 ""Garfield""! We will return every time we are in Bangkok."
"Amazing roof top . The cocktail were very good the view super and most off the staff was super cool special thanks to ice and mild , whom accommodate us five star!! Food was great and came quickly  Amazing"
"The best service in BKK We didn’t stay here but we came here only for dinner buffet. In the period of Covid-19, the hotel was so much care about all guests, from G floor to the restaurant, I felt safe here 99.99% from the virus. Hostess was so politely and welcoming us. The atmosphere and the music quite boring for me. But there are good things as well ,almost items looked so clean as you can see all the covers, kitchen staff were always staying at the station. Tawan was so nice, EXCELLENT service staff ever, I saw him at the grill station after that he came to served that food for us then he cleared the empty plate!!! You are my man!! Dessert made me so happy at the end. Last but not least, even some foods hadn’t had in the line but they were provided the items and apparently"
We booked a room the wrong room type . Normally we want to book for two bed but we booked one king bed.And Mr.Mild is really great Guest Service Manager.He can manage and help us to stay in two bed room
"During I stay here, I have a wonderful time with the hotel such as the room is very clean and smell good. In addition, the hotel is very close to the mall that you can walk by sky walk and you can go anywhere with BTS sky train. And the great service from Ice make me feel more VIP. Thank you for making our special trip in Bangkok."
Beatiful stay. Very good Service from Ice and Garfield. We had a nice stay here in Bangkok for four nights. We would stay here everytime againe. Very clean and everyone strives to keep guests happy. The cocktails are the BEST we ever drunk. The presentation was unique.
"Ice, garfin nan very nice people, looked after us very well. Beautiful views, modern music with relaxed atmospheres. Great selection of drinks with great prices. Would recommend for anyone looking for a good place to have drinks and food"
"lovely view of the Bangkok city with comfy chairs, very nice staff and great place to have a beer, free WiFi. Wasn’t staying in hotel but the barman was very accommodating and had a lovely time seeing the bright lights of Bangkok"
"Always happy to stay in the hotel and take advantage of the rooftop pool and adjoining bar. There are plenty of daybeds to relax and a nice view. The staff is super friendly, especially Garfield who has been working here for some years now."
